,Unnamed: 0,match,q1,q2
2031,2031,0,五种瘦身早餐 让你轻松瘦下来,三件能让你快乐的事
985,985,1,金针菇的营养价值,金针菇的营养
2847,2847,0,眼部皮肤脆弱 如何护眼？,电脑族食疗护眼食物
2175,2175,0,掌握5种技巧 让面膜效果加倍,清洁面膜：黄瓜柠檬面膜
1841,1841,0,5个注意事项 将染发伤害降到最低,5个注意事项将染发伤害降到最低
725,725,1,口蘑的功效与作用,口蘑有什么作用
238,238,1,减肥先排毒 3个诀窍教你做无毒美人,有什么秘诀可以做无毒美人
452,452,1,丰胸食材 多吃这些让您风韵犹存,多吃哪些食材可以丰胸
2511,2511,0,4种饮食法 专门瘦小腹,哪些饮食缓解老人高血压
582,582,1,每天吃点菌类食品，营养加分,每天食用菌类食物，能给营养加分吗
1241,1241,0,16种果蔬让女性更美丽,果蔬的营养和功效有哪些
548,548,1,黑木耳的功效与作用及食用方法,黑木耳有什么功效
2905,2905,0,牢记生活细节 甩掉你的小肚腩,5种食物轻松吃出小肚腩
2187,2187,0,皮肤会变黑全是因为它们,白发变黑发的食谱有什么
2303,2303,0,食疗还是保健品 女性应该怎样补充胶原蛋白,尿道炎食疗
1222,1222,0,自制美容养生粥 方便美味又健康,食疗养生粥
2573,2573,0,8种食物能轻松消除小肚腩,易发胖长小肚腩饮食
856,856,0,瓜果蔬菜护肤 全球春季正当红,各类瓜果分别有什么养生功效！
2600,2600,0,牛肝菌的功效与作用及做法,什么牛肝菌最好
642,642,1,头状秃马勃的功效与作用,头状秃马勃有怎样的作用和功效
800,800,0,黑木耳瘦身食谱简单DIY,黑木耳禁忌有哪些
2443,2443,0,平菇的营养价值及功效,平菇培养基
1995,1995,0,3月怎能不减肥 3种可以减肥的食物,减肥食谱
1047,1047,0,这些穴位经常按摩可以减肥,胃疼时按这个穴位能缓解
1614,1614,0,六大健康食物给爱美的你,哪些食物为碱性食物
736,736,1,猴头菇的功效与作用,猴头菇有什么作用
663,663,1,鸡枞菌的营养价值及做法,鸡枞菌的营养价值有哪些
1522,1522,0,吃水果来减肥的2个误区,走出饮食误区
1273,1273,0,平菇的营养成分及药用价值,平菇是什么？
2865,2865,0,喝啤酒会长胖么？,啤酒果的做法有哪些
2867,2867,0,猴头菇的功效与作用,猴头菇价格
2688,2688,0,春季美颜的4种食材,哪些食物可以美颜？
897,897,0,4种方法教会你喝柠檬水减肥,减肥计划
3287,3287,0,果蔬让女性更有魅力,果蔬干的营养不等于果蔬
2834,2834,0,晚餐饮食减肥的5个技巧,减肥食谱
1120,1120,0,这些食物只吃不胖！减肥族请保存,减肥计划
2488,2488,0,青苹果防止肥胖,青苹果的保鲜方法有哪些
3272,3272,0,这些食物是长肉的助手，减肥的敌人,睡觉也不长肉十种食物
1684,1684,0,适量蔬果汁 排毒又美容,天然蔬果含什么毒素
2458,2458,0,秋季护肤 美白防晒不能停,夏季必吃防晒食物
20,20,1,秋季护肤 美白防晒不能停,秋季护肤要注意什么
757,757,1,红菇的营养价值及功效,红菇有什么功效
3088,3088,0,吃蔬菜有啥好处？巧吃蔬菜不变老,还有啥字谜
960,960,0,想减肥？米饭应该这么吃,米饭团做法有哪些
1497,1497,0,女人吃枣，红颜不老,吃枣五大禁忌
50,50,1,减肥美容冬瓜饮的自制方法,怎么做冬瓜饮
1207,1207,0,5种食物容易伤害皮肤 远离！,远离快餐综合症
223,223,1,妙用5种食物 轻松改善粗糙肌肤,有什么食物可以改善粗糙肌肤
540,540,1,8款美容面膜DIY,怎样DIY美容面膜
1668,1668,1,4款食谱助你保养皮肤消雀斑,消除雀斑的天然食物
1555,1555,0,黑木耳饮食宜忌百科,感冒期间的饮食宜忌
2618,2618,0,8个饮食原则 让你怎么吃都不胖,脑溢血饮食
392,392,1,吃蔬菜沙拉可以减肥吗 原来是这么回事儿,蔬菜沙拉有什么功效
3215,3215,0,减肥沙拉那种酱好 这三种酱可代替沙拉酱,做三明治用什么酱好原来是这两种
2359,2359,0,女人必备的黄金食物,减肥必备晚餐
724,724,1,羊肚菌的功效与作用,羊肚菌有哪些作用和功效
1765,1765,0,猪尾凤爪香菇汤美容丰胸效果佳,杜仲炖猪尾好不好吃
1552,1552,0,黑木耳饮食宜忌百科,学龄前儿童食物宜忌
78,78,1,春季也需要防晒，分享几个小技巧,春季怎么防晒
2094,2094,0,经期减肥法 确有效果还是商家炒作,经期不能喝的茶有哪些
1775,1775,0,肠道顺自然瘦！每天1杯果汁养成易瘦体质,吃什么水果可以清肠道
88,88,1,轻易祛斑小妙招：丝瓜调和蜂蜜,那些美食可以祛斑
91,91,1,使用护发素要看发质 用错易长头皮屑,油性发质可以用护发素吗
334,334,1,减肥不吃早餐的五大危害,减肥不吃早餐有什么危害
241,241,1,减肥的人注意：4种吃法扰乱新陈代谢,哪些吃法扰乱新陈代谢
115,115,1,六大健康食物给爱美的你,哪些食物健康又美容
2080,2080,0,饮食减肥大全,减肥计划
385,385,1,4种方法教会你喝柠檬水减肥,哪些方法喝柠檬水可以减肥
2357,2357,0,春季减肥4大问 排毒帮你减体重,什么果汁排毒
1005,1005,0,吃水果减肥 两大误区一定认清,儿童饮食误区多
696,696,1,平菇的功效与作用及购买指南,怎样的平菇才算好的平菇
728,728,1,口蘑的功效与作用,口蘑的功效有哪些
2806,2806,0,减肥先排毒 3个诀窍教你做无毒美人,能够吃白的诀窍
1923,1923,0,肥胖的真正敌人是谁？,肥胖孕妇的饮食注意
3049,3049,0,多吃菌菇 能够美容养出好皮肤,老人多吃菌菇可保护血管
3267,3267,0,这些食物是长肉的助手，减肥的敌人,吃零食不长肉的方法
256,256,1,减肥要健康 10种小秘方帮你解决,推荐几种减肥又健康的秘方
1925,1925,0,肥胖的真正敌人是谁？,身体里缺乏这些最容易肥胖
3128,3128,0,蘑菇的功效与作用及营养价值,这是什么蘑菇
314,314,1,这些食物只吃不胖！减肥族请保存,只吃不胖的食物哪些
1194,1194,0,这样吃粗粮 不用运动也能变瘦,全身都变瘦简单奏效的顶级食物
82,82,1,三种食物吃出水嫩肌肤,有几种食物可以水嫩肌肤
1570,1570,0,减肥人士吃鸡蛋不应该排斥蛋黄,蛋黄的作用有哪些
1848,1848,0,山楂减肥汤 瘦成女神很简单,山楂的药用价值
435,435,1,"好肤色也可以""喝""出来 8款适合女性的滋补汤",推荐一些滋补汤
3254,3254,0,美容巧吃三文鱼,三文鱼的做法
486,486,1,小脸美女5步搞定,推荐一些瘦脸的技巧
812,812,0,改善皮肤暗黄不做“黄脸婆”,拒绝黄脸婆6款食疗可调理
351,351,1,不避开这6大误区 美白就白做了,美白就白做了是哪些导致的
2722,2722,0,4个小窍门帮你快速瘦掉大粗腿,天然蔬菜可以帮你养生
3160,3160,0,为啥你喝凉水都长肉？,煮蚬子用凉水还是热水
1153,1153,0,上班族减掉赘肉的小妙招,消除口臭有妙招
2906,2906,0,牢记生活细节 甩掉你的小肚腩,11种食物甩掉你的小肚腩
2711,2711,0,经常看电脑眼睛都要瞎掉了 喝这个管用吗,婴儿便秘吃什么管用
286,286,1,减肥最佳食品——豆腐,豆腐是减肥最佳食品吗
1743,1743,0,菠萝帮你清体美容消脂,不同颜色食物帮你减肥
2406,2406,0,不避开这6大误区 美白就白做了,饮食营养十误区
1983,1983,0,想要减肥的你今天吃早餐了吗,吃早餐常常犯的五个错误！
749,749,1,平菇的营养价值及功效,平菇的营养价值怎么样
2575,2575,0,8种食物能轻松消除小肚腩,睡前睡后赶走小肚腩
1739,1739,0,菠萝帮你清体美容消脂,水果帮你解决便秘烦恼
1390,1390,0,减肥的人注意：4种吃法扰乱新陈代谢,明太鱼吃法
1890,1890,0,春季减肥 9种吃法让你越吃越瘦,越吃越瘦的五谷杂粮，吃着吃着就瘦了
1225,1225,0,6种食物让你越吃越黑,绿叶蔬菜不会“越吃越黑”
1008,1008,0,吃水果减肥 两大误区一定认清,补血食品到底有哪些，走出六误区
3302,3302,0,燃烧脂肪的三大食物,脂肪高的食物有哪些？
842,842,0,竹荪的营养价值及食疗偏方,竹荪的做法
924,924,0,香菇的营养价值及做法,香菇大米粥有哪些营养
1011,1011,0,吃水果减肥 两大误区一定认清,饮食习惯新误区
1888,1888,0,春季减肥 9种吃法让你越吃越瘦,让你越吃越瘦的15种食物
836,836,0,九个方法帮你快速去掉黑眼圈,帮你挑选减压食品
594,594,1,金针菇的功效与作用,金针菇有怎么样的功效
2369,2369,0,怎样消除妊娠纹,月子美食巧妙去除妊娠纹！
1487,1487,0,燕麦八宝饭 最简单的减肥饭,八宝饭常见食材的营养
1356,1356,0,饭前喝点水就能瘦？,吃什么瘦大腿效果好？
141,141,1,3款美容食谱,吃什么可以美容
1706,1706,0,电脑族美容 轻松祛斑小妙招,吃什么水果祛斑？
421,421,1,春季减肥的九个方法,减肥春季有什么技巧
532,532,1,番茄瘦身法,有哪些番茄瘦身法
76,76,1,春季也需要防晒，分享几个小技巧,春季防晒有哪些技巧
2069,2069,0,经常染发？你需要这4种食物,染发的4大危害一不小心可致癌
556,556,1,黑木耳的功效与作用及食用方法,能不能告诉我黑木耳的功效和食用方法
410,410,1,晚餐饮食减肥的5个技巧,推荐晚餐饮食减肥的技巧
2041,2041,0,春季皮肤常见问题 3个对策各个击破,缓解便秘的食疗对策
2724,2724,0,4个小窍门帮你快速瘦掉大粗腿,消化不良这些茶能帮你
566,566,1,乳酸菌的作用与功效,乳酸菌有什么作用
1056,1056,0,每天坚持吃蔬果 轻松瘦身,鸡蛋瘦身减肥
2899,2899,0,便宜材料 强力美白,美白紧肤面膜
1917,1917,0,肥胖的真正敌人是谁？,产后肥胖的定义
1167,1167,0,秋季食物美白偏方,食物美白偏方
1175,1175,0,教你8个怎么吃都不胖的妙招,教我做几种好吃的、菜馅饼吧！
922,922,0,香菇的营养价值及做法,香菇什么样的好
539,539,1,8款美容面膜DIY,如何自制美容面膜
2425,2425,0,哪些食物可以越吃越白,让女性越吃越白的三大秘方
322,322,1,女性脱发不可怕 这6个方法能帮到你,女性脱发有什么方法解决
1951,1951,0,毛木耳-纺织和矿山工人很好的保健食品,保健养肝茶有哪些
449,449,1,5个注意事项 将染发伤害降到最低,染发避开哪些
1551,1551,0,黑木耳饮食宜忌百科,咳嗽宜忌原则
2426,2426,0,哪些食物可以越吃越白,女性越吃越白的美白饮食
3305,3305,0,王牌减肥食物超燃脂 简单吃吃狂掉肉,多吃吃黄皮对人体有什么好处？
2029,2029,0,五种瘦身早餐 让你轻松瘦下来,5种早餐吃法会让你折寿
344,344,1,蜂蜜生姜水防老年斑,蜂蜜生姜水有什么功效
2392,2392,0,适合减肥的九款低热量食物,减肥计划
316,316,1,春季皮肤常见问题 3个对策各个击破,怎么解决春季皮肤问题
1903,1903,0,几种具有保健功效的菌类食物,这是什么菌类
3263,3263,0,盘点5大瘦脸食物 轻松吃出V形脸,面食大盘点，到底哪些是你的最爱？
3029,3029,0,草莓沙拉可减肥 酸奶代替沙拉酱,法式沙拉酱
2197,2197,0,酸奶加点料 甩掉小肚腩,3步帮你轻松减掉小肚腩
666,666,1,鸡枞菌的营养价值及做法,怎样制作才能更好的提高鸡枞菌的营养价值
1489,1489,0,燕麦八宝饭 最简单的减肥饭,八宝饭简单又好吃的做法？
2784,2784,0,盘点减肥要远离的四大食物,减肥食品
788,788,1,黑木耳饮食宜忌百科,黑木耳不能与什么食物搭配
363,363,1,春季减肥要注意 运动为主节食为辅,春季怎么运动和解决可以减肥要注意什么
1009,1009,0,吃水果减肥 两大误区一定认清,我们养生的误区有哪些？
997,997,0,原来茶叶水能这样用来美容！,美容水果有哪些呢
2889,2889,0,润肤养发四季百搭美食 这种食物真的有,小孩养脾胃食物有哪些
1997,1997,0,3月怎能不减肥 3种可以减肥的食物,减肥计划
243,243,1,关于生理期减肥 有四点要清楚,生理期期间减肥要清楚哪些
127,127,1,九个方法帮你快速去掉黑眼圈,推荐去掉黑眼圈的方法
525,525,1,蔡依林三个苗条魔咒,蔡依林苗条魔咒是什么
2805,2805,0,减肥先排毒 3个诀窍教你做无毒美人,私处护理的诀窍有哪些
8,8,1,肠道顺自然瘦！每天1杯果汁养成易瘦体质,怎么能变成易瘦体质
335,335,1,减肥不吃早餐的五大危害,有哪些危害是减肥不吃早餐导致的
848,848,0,调理肠胃 赶走便秘的4种食物,哺乳期便秘吃什么
658,658,1,鸡腿菇的做法及营养价值,怎样制作才能更好的提高鸡腿菇的营养价值
213,213,1,黑木耳瘦身食谱简单DIY,黑木耳搭配哪些食谱有瘦身效果
96,96,1,鸡蛋去黑头 因人而异有点儿用,鸡蛋可以祛黑头吗
2514,2514,0,4种饮食法 专门瘦小腹,脑溢血饮食
1512,1512,0,吃菌子的坏处,咖啡的坏处
1160,1160,0,哪种食用菌营养价值更高,食用菌黑木耳的功效
2388,2388,0,适合减肥的九款低热量食物,减肥餐
2548,2548,0,秋季吃枣 美白抗衰老,天然美白方法
1957,1957,0,芝麻花生帮女人身材升Cup！,芝麻的由来
1231,1231,0,核桃新吃法 让你的头发又黑又亮,明太鱼吃法
1018,1018,0,减肥2神器 香蕉和酸奶,酸奶沙拉的做法有哪些
813,813,0,改善皮肤暗黄不做“黄脸婆”,养好脾胃不做黄脸婆
2897,2897,0,便宜材料 强力美白,美白肌肤吃什么呢
881,881,0,美容养颜 教你“喝”掉斑点,减肥养颜食谱有哪些？
1843,1843,0,香蕉8大益处 健体亦美容,5种食品强身健体具有神奇技能
2441,2441,0,平菇的营养价值及功效,平菇需要焯水吗
1942,1942,0,关于生理期减肥 有四点要清楚,减肥方法
1480,1480,0,加速衰老的6种行为,哪些食物可以抗衰老
2455,2455,0,秋季护肤 美白防晒不能停,妙吃水果的防晒护理
169,169,1,狂吃减压易发胖 选对食物没问题（）,推荐好吃不发胖的食物
3218,3218,0,减肥沙拉那种酱好 这三种酱可代替沙拉酱,黄金酱做法有哪些
1576,1576,0,减肥人士吃鸡蛋不应该排斥蛋黄,蛋黄的营养都有哪些呢
2589,2589,0,银耳的营养价值,银耳的吃法有哪些
361,361,1,喝3种茶去除口臭，与人交流不再尴尬,去除口臭的茶有哪些
474,474,1,玉米的养颜功效,推荐一些养颜功效的食物
1971,1971,0,手把手教你做减肥果汁,手把手教你正山小种冲泡方法
65,65,1,为啥你喝凉水都长肉？,为什么我喝水都长肉
1244,1244,0,16种果蔬让女性更美丽,果蔬干的营养不等于果蔬
1271,1271,0,平菇的营养成分及药用价值,平菇的做法
858,858,0,瓜果蔬菜护肤 全球春季正当红,夏季最解暑的几种瓜果
931,931,0,咖啡加盐 去苦味助减肥,柠檬水加盐喝的好处
146,146,1,食疗还是保健品 女性应该怎样补充胶原蛋白,保健品可以补充胶原蛋白吗
2767,2767,0,十二个最快减肥秘籍法,减肥减肥减肥减肥
928,928,0,红血丝怎么修复 红血丝应该怎么办,脸上长红血丝原因，4种方法可根治
2526,2526,0,减肥效果最佳的3个时间,减肥方法
472,472,1,自制萝卜减肥汤,萝卜可以用来做减肥汤吗
2666,2666,0,巧克力是美容神器 但是不宜多吃,排毒八大神器
3253,3253,0,美容巧吃三文鱼,浅谈三文鱼
1819,1819,0,5时段喝水才能真正瘦下来,喝水的最佳时间
691,691,1,猴头菇的营养价值,猴头菇的营养价值怎么样
1353,1353,0,饭前喝点水就能瘦？,什么食物可以瘦腿的啊？
2156,2156,0,6款番茄减肥食谱 让你吃出好身材,经常吃它们让你更快衰老
471,471,1,自制萝卜减肥汤,怎么自制减肥汤
1837,1837,0,春季也需要防晒，分享几个小技巧,多吃蕃茄可防晒
2467,2467,0,为爱美女性搭配合理美容餐,三餐营养食谱有哪些
129,129,1,低脂食品不能减脂，还会使人发胖,使人发胖的食品有哪些
1393,1393,0,减肥的人注意：4种吃法扰乱新陈代谢,蜂蜡有哪些吃法
1395,1395,0,减肥的人注意：4种吃法扰乱新陈代谢,鱼生的吃法有哪些
970,970,0,美味芦笋15日完美瘦身,芦笋还有什么名字
2716,2716,0,经常看电脑眼睛都要瞎掉了 喝这个管用吗,养颜祛斑吃什么？这些调理方法很管用！
3225,3225,1,减肥要吃4种食物 让你变成“小腰精”,减肥蔬菜
235,235,1,5类减肥食物 吃着就能瘦,那类食物吃了就能瘦
1621,1621,0,六大健康食物给爱美的你,哪些食物富含酪氨酸
1139,1139,0,要是减肥 喝水都能瘦,喝水的学问
1939,1939,0,关于生理期减肥 有四点要清楚,减肥食谱
3292,3292,0,果蔬让女性更有魅力,果蔬营养面哪家好？
2872,2872,0,喝豆浆减肥？教你科学减肥,豆浆有什么营养
2563,2563,0,3款美容食谱,高血压食谱有哪些
3189,3189,1,10款丰胸汤 吃出C杯胸不是梦,丰胸美白的食物有哪些
852,852,0,调理肠胃 赶走便秘的4种食物,哪些水果治便秘最好
631,631,1,银耳的功效与作用,银耳有什么功效
1605,1605,0,鸡蛋去黑头 因人而异有点儿用,因人而异的防秋燥食疗法
2643,2643,0,这种减肥泡菜 三分钟搞定,四招搞定胎儿口味
1501,1501,0,女人吃枣，红颜不老,四类人吃枣要谨慎
1494,1494,0,女人吃枣，红颜不老,吃枣的注意事项
1423,1423,0,枸杞桂圆汤 加上3种料美容更营养,什么样的桂圆好
1109,1109,0,喝茶能够祛斑？要怎样喝呢？,祛斑有哪几种有效的方法
1502,1502,0,7大抗皱水果 助你破解肌肤的皱语,三十条美容去皱妙招
530,530,1,美味芦笋15日完美瘦身,美味芦笋怎样完美瘦身
3114,3114,0,两周都可以不重样 11种低卡路里早餐推荐,主要经营哪些早餐
453,453,1,丰胸食材 多吃这些让您风韵犹存,吃什么可以丰胸
3185,3185,1,10款丰胸汤 吃出C杯胸不是梦,女人吃什么长胸
1990,1990,0,几款自制养颜美容茶助你排出毒素,七种茶助你防癌又润肺
1716,1716,0,怎样防止乳防下垂,小肠下垂的意见建议:
69,69,1,备孕推荐食谱,适合备孕期吃的食谱有哪些
1375,1375,0,牛肝菌的营养价值及食用功效,牛肝菌是什么
3074,3074,1,怎么去鱼尾纹 用这物就能解决,吃喝之中轻松赶走鱼尾纹
2896,2896,0,便宜材料 强力美白,花生美白牙齿
2608,2608,0,牛肝菌的功效与作用及做法,牛肝菌是什么呢
1662,1662,0,春季减肥要注意 运动为主节食为辅,节食不排毒反而排营养
274,274,1,5大减肥技巧 让你越吃越瘦,有什么技巧能越吃越瘦
2697,2697,0,少吃多餐可以减肥 如何吃才最减肥,宝宝餐
3182,3182,1,备孕推荐食谱,备孕应该吃什么食物？
2595,2595,0,银耳的营养价值,银耳是什么
1814,1814,0,5个保湿小技巧帮你养出Q弹肌,不同颜色食物帮你减肥
1920,1920,0,肥胖的真正敌人是谁？,短期肥胖的原因是什么
592,592,1,黑木耳的功效与作用,黑木耳有怎样的功效和作用
1208,1208,0,5种食物容易伤害皮肤 远离！,长痘痘远离这些食物
450,450,1,女性每日一把葡萄干,经常吃葡萄干有什么好处
330,330,1,6款番茄减肥食谱 让你吃出好身材,哪些番茄有减肥效果（）
1536,1536,0,竹荪的营养价值,竹荪是什么？
54,54,1,五款美白汤饮喝出嫩白肌肤,怎么做美白汤
269,269,1,吃出来的俏丽容颜 4道药膳来美容,如何用药膳美容，想拥有俏丽容颜
1877,1877,0,低脂食品不能减脂，还会使人发胖,健美减脂的食谱有哪些
3289,3289,0,果蔬让女性更有魅力,哪些果蔬能瘦身
2689,2689,0,少吃多餐可以减肥 如何吃才最减肥,职工餐菜谱
802,802,0,黑木耳瘦身食谱简单DIY,哪些女星被爆黑木耳
3104,3104,0,怎么吃都不长肉？太瘦的人要当心了,吃饭要当心这些致癌组合
3006,3006,0,鸡枞菌的营养价值及做法,膳食营养原则有哪些
1709,1709,0,怎样防止乳防下垂,防止臀部下垂的最佳食品
2676,2676,0,改善干燥 春季多吃胡萝卜,紫色胡萝卜
1329,1329,0,松露是什么,松露巧克力做法
83,83,1,三种食物吃出水嫩肌肤,推荐水嫩肌肤的食物
2768,2768,0,十二个最快减肥秘籍法,减肥食谱
1234,1234,0,核桃新吃法 让你的头发又黑又亮,蜂蜡有哪些吃法
2762,2762,1,红菇的营养价值及功效,红菇的药用价值有哪些
2058,2058,0,石斛的5种吃法 美容又养生,石斛可以同什么一起煲汤
717,717,1,牛肝菌的功效与作用及做法,牛肝菌怎样制作才是更好的
3276,3276,1,消除小肚腩的10种食物,五款茶饮去掉小肚腩
2242,2242,0,每天吃点菌类食品，营养加分,白领丽人应吃点什么？
2416,2416,0,吃白菜能减肥？ 这样吃才有效,柑橘的止咳生津之效
254,254,1,脸蛋红血丝是怎么形成的 能去除吗？,去除脸蛋红血丝有什么妙招
2938,2938,0,节食减肥会引起这6个病症,节食减肥要注意的问题
405,405,1,多吃菌菇 能够美容养出好皮肤,美容养出好皮肤要多吃菌菇
1687,1687,0,小脸美女5步搞定,9种食品吃出精致小脸
2607,2607,0,牛肝菌的功效与作用及做法,鲜牛肝菌的做法
1649,1649,0,平菇的做法及功效,平菇和什么相克
838,838,0,竹荪的营养价值及食疗偏方,竹荪的作用
155,155,1,5个保湿小技巧帮你养出Q弹肌,哪些保湿技巧可以养出Q弹肌
2202,2202,0,治疗女性月经量少的5大健康食谱,家常菜食谱
2646,2646,0,想要祛斑？多吃绿豆百合,祛斑吃什么食物调理
465,465,1,女人必备的黄金食物,哪些是黄金食物
628,628,1,竹荪的功效与作用,竹荪有哪些作用和功效
945,945,0,美容祛斑 4种食物帮你轻松解决,7食物帮你调节内分泌
1510,1510,0,7大抗皱水果 助你破解肌肤的皱语,4种超有效去皱食物
2380,2380,0,减肥食谱可不能少了苦瓜,苦瓜做法
3294,3294,0,燃烧脂肪的三大食物,中小学生与脂肪
68,68,1,初秋养肺食疗法 不容忽视的养生法则,告诉我养肺的食疗方
1523,1523,0,吃水果来减肥的2个误区,点菜八大误区
1595,1595,0,金针菇的功效与作用,酸辣金针菇
619,619,1,羊肚菌的营养价值及做法,羊肚菌的营养价值有哪些
2809,2809,0,减肥先排毒 3个诀窍教你做无毒美人,有什么养肝的诀窍
1418,1418,0,9种吃了不用去美容院的食物,还去美容院？一种食物就搞定了
2016,2016,0,晚上这样吃，只会越来越瘦,吃什么可以瘦屁股呢
3034,3034,0,草莓沙拉可减肥 酸奶代替沙拉酱,沙拉酱用法
2036,2036,0,五种瘦身早餐 让你轻松瘦下来,男人肾虚六款食谱让你金枪不倒
1408,1408,0,黑木耳的功效与作用及食用方法,黑木耳禁忌有哪些
3105,3105,0,两周都可以不重样 11种低卡路里早餐推荐,高中生早餐
394,394,1,减肥吃鱼腥草，效果好不好？,减肥吃鱼腥草效果怎么样
1755,1755,0,健康减肥 6种蔬菜帮你快速瘦身,果蔬汁减肥瘦身饮有哪些
413,413,1,怎样防止乳防下垂,乳防下垂是什么导致的
2538,2538,0,吃蔬菜沙拉可以减肥吗 原来是这么回事儿,蔬菜沙拉需要什么蔬菜呢
1630,1630,0,8种青春永驻妙招 让你永远18岁,饮食解压有妙招
1998,1998,0,3月怎能不减肥 3种可以减肥的食物,减肥方法
2860,2860,0,喝啤酒会长胖么？,什么罐装啤酒好喝
1152,1152,0,上班族减掉赘肉的小妙招,饮食解压有妙招
652,652,1,青头菌的做法及功效,青头菌的制作方法有哪些
425,425,1,吃白菜能减肥？ 这样吃才有效,推荐有效减肥的蔬菜
2405,2405,0,不避开这6大误区 美白就白做了,我们养生的误区有哪些？
281,281,1,西红柿可祛斑 你知道到吗,西红柿有什么功效
1348,1348,0,鸡油菌的做法及功效,鸡油菌是什么
339,339,1,核桃松仁粟米羹美容又健胸,推荐美容又健胸的食品
2020,2020,0,学会5招让你久坐不发胖,6个减肥小妙招拒绝久坐肥胖
2292,2292,0,美肤瘦身多吃豆类食品,咖啡因的作用，美肤效果好
796,796,0,一不留神就发胖：走路吃东西易发胖,孕妇进补，样样需留神!
585,585,1,竹荪的营养价值,竹荪的营养价值怎么样
272,272,1,吃水果减肥 两大误区一定认清,吃水果就能减肥吗
1359,1359,0,饭前喝点水就能瘦？,吃什么瘦腿效果好？
2599,2599,0,控制饭量 保持体重,控制饭量保持体重
1697,1697,0,加餐4个小技巧 减肥成功吃得好,上班时来个水果加餐，健康更多
230,230,1,喝可乐可以越喝越瘦 不是骗人的,喝可乐能瘦吗 是不是骗人的
1312,1312,1,竹荪的功效与作用,竹荪的作用
3048,3048,0,多吃菌菇 能够美容养出好皮肤,哪些人不宜食用菌菇？菌菇的副作用有哪些?
3083,3083,0,喝3种茶去除口臭，与人交流不再尴尬,口臭三清茶是什么？
2559,2559,0,3款美容食谱,食谱家常菜
608,608,1,鸡油菌的做法及功效,鸡油菌的制作方法有哪些
3249,3249,0,美容巧吃三文鱼,什么是三文鱼
384,384,1,4种方法教会你喝柠檬水减肥,怎么正确喝柠檬水有减肥效果
1373,1373,0,牛肝菌的营养价值及食用功效,牛肝菌的作用
3024,3024,0,玉米的养颜功效,美容养颜茶有哪些
678,678,1,平菇的营养成分及药用价值,平菇有哪些药用价值
2662,2662,0,帮助你快速减肥的五个方法,减肥蔬菜什么蔬菜减肥
424,424,1,吃白菜能减肥？ 这样吃才有效,哪些蔬菜怎么吃菜有效减肥
672,672,1,平菇的做法及功效,平菇的功效有哪些
1276,1276,0,蜂蜜生姜水防老年斑,老年斑吃什么效果最好？
2855,2855,0,5类减肥食物 吃着就能瘦,减肥计划
714,714,1,牛肝菌的功效与作用及做法,牛肝菌有怎样的作用和功效
3291,3291,0,果蔬让女性更有魅力,果蔬拼盘
787,787,1,黑木耳饮食宜忌百科,吃黑木耳应该注意什么
