,Unnamed: 0,match,q1,q2
854,854,0,瓜果蔬菜护肤 全球春季正当红,3大常见瓜果
266,266,1,教你只花4分钟 炮制减肥早餐,怎么快捷做出减肥早餐
1972,1972,0,手把手教你做减肥果汁,手把手教你做曲奇
3108,3108,0,两周都可以不重样 11种低卡路里早餐推荐,营养早餐有哪些？
1186,1186,0,这样吃粗粮 不用运动也能变瘦,10个胖子能变瘦的饮食法则
2270,2270,0,减肥食物 16种减肥食物排行榜,减肥食谱
3142,3142,1,西红柿可祛斑 你知道到吗,祛斑的食物
984,984,0,金针菇的营养价值,金针菇的做法
2493,2493,0,青苹果防止肥胖,青苹果有什么好处？
2067,2067,0,一日吃仨枣保健又美容,对症美容
1768,1768,0,肠道顺自然瘦！每天1杯果汁养成易瘦体质,吃什么食物对肠道好呢
1722,1722,0,铆钉菇的功效与作用,酿金钱菇的制法
2976,2976,0,"好肤色也可以""喝""出来 8款适合女性的滋补汤",滋补养肾煲什么汤喝好
795,795,0,一不留神就发胖：走路吃东西易发胖,留神！这些不甜的高糖食物
1174,1174,0,教你8个怎么吃都不胖的妙招,教你几种盖饭的作法
660,660,1,毛木耳-纺织和矿山工人很好的保健食品,毛木耳有什么功效适合什么人群
859,859,0,瓜果蔬菜护肤 全球春季正当红,五谷丰登瓜果飘香什么意思
1457,1457,0,饭前吃蔬菜有助减肥,减肥食谱
2660,2660,0,帮助你快速减肥的五个方法,减肥计划
2927,2927,0,香菇健康饮食百科,香菇的食用方法有哪些
824,824,0,4款膳食让你罩杯疯长,别为了一时的嘴瘾而让肿瘤疯长
148,148,1,10款丰胸汤 吃出C杯胸不是梦,哪些汤有丰胸的效果
2400,2400,0,吃素减肥不可取,一杯茶从早泡到晚不可取!
2408,2408,0,不避开这6大误区 美白就白做了,孩子的饮食误区
2389,2389,0,适合减肥的九款低热量食物,减肥减肥减肥减肥
1364,1364,0,想要美白 这些食物要少吃,月经少吃什么食物好？
815,815,0,吃出来的俏丽容颜 4道药膳来美容,不孕药膳方
3199,3199,0,初秋养肺食疗法 不容忽视的养生法则,奶瓶刻度：不容忽视的细节
2734,2734,0,鸡腿菇的做法及营养价值,炒鸡腿菇的做法
493,493,1,上班族运动减肥 别犯这4种错误,上班族运动减肥，要注意哪些
810,810,0,改善皮肤暗黄不做“黄脸婆”,8招养足气血不当黄脸婆
167,167,1,3大减肥食谱 高效燃脂瘦身,有哪些食谱可以高效燃脂瘦身
2399,2399,0,吃素减肥不可取,5种早餐吃法不可取
1172,1172,0,教你8个怎么吃都不胖的妙招,哪教卤肉技术味道最正宗
2078,2078,1,饮食减肥大全,减肥食谱
1670,1670,0,4款食谱助你保养皮肤消雀斑,6个去雀斑小偏方
2970,2970,0,香菇的功效与作用,榆黄菇和香菇哪个种植比较好
1034,1034,0,春季护肤怎么做 补充维C能保湿,哪种蔬菜含维C最高？
3187,3187,1,10款丰胸汤 吃出C杯胸不是梦,丰胸食物有哪些？
1698,1698,0,加餐4个小技巧 减肥成功吃得好,孕期科学加餐宝宝才会更健康
2760,2760,1,红菇的营养价值及功效,红菇药用价值是什么
293,293,1,减肥要吃4种食物 让你变成“小腰精”,怎么变成小腰精，要吃哪些减肥食物
1527,1527,0,吃水果来减肥的2个误区,饮食习惯新误区
427,427,1,睡前几个动作甩掉大肚腩,怎么甩掉大肚腩
1623,1623,0,六大健康食物给爱美的你,哪些食物为酸性食物
1799,1799,0,上这5种肉最适合减肥的人吃,减肥餐
2771,2771,0,十二个最快减肥秘籍法,减肥方法
1695,1695,0,加餐4个小技巧 减肥成功吃得好,教你减肥加餐不发胖
889,889,0,美容养颜 教你“喝”掉斑点,女性养颜食品有哪些呢
2670,2670,0,改善干燥 春季多吃胡萝卜,胡萝卜的引入
2327,2327,0,喝点红豆水帮你消肿瘦脸,瘦脸吃什么水果呢？
487,487,1,减肥人士吃鸡蛋不应该排斥蛋黄,吃鸡蛋不吃蛋黄对减肥有帮助没
1718,1718,0,小事让皮肤变好,9种食物让你心情变好
1275,1275,0,平菇的营养成分及药用价值,平菇鸡蛋汤
144,144,1,6种方法 选出优质胶原蛋白食物,胶原蛋白食物，怎么挑选
1772,1772,0,肠道顺自然瘦！每天1杯果汁养成易瘦体质,肠道最喜欢的食物
751,751,1,平菇的营养价值及功效,平菇的功效有哪些
132,132,1,瓜果蔬菜护肤 全球春季正当红,春季吃什么可以护肤
2948,2948,1,香菇：排毒抗癌，益气治风,吃什么排毒
2053,2053,0,石斛的5种吃法 美容又养生,石斛功效作用是什么
1123,1123,0,皮肤保养的饮食宜忌 让你的皮肤吹弹可破,脂肪肝的饮食宜忌
2198,2198,0,酸奶加点料 甩掉小肚腩,睡前睡后赶走小肚腩
2534,2534,0,吃蔬菜沙拉可以减肥吗 原来是这么回事儿,蔬菜沙拉调料有哪些
1952,1952,0,毛木耳-纺织和矿山工人很好的保健食品,保健灵身茶
986,986,0,清肠素食 肠道变得更年轻,6种食物清洁肠道
916,916,0,塑身养颜 喝点蔬菜汁,"自制果汁或者蔬菜汁,有什么好的搭配吗,谢谢"
651,651,1,青头菌的做法及功效,青头菌要怎么做
577,577,1,几种具有保健功效的菌类食物,哪些菌类食物具有保健的功效
265,265,1,电脑族美容 轻松祛斑小妙招,经常看电脑，怎么美容
1365,1365,0,想要美白 这些食物要少吃,贫血饮食上应少吃什么
855,855,0,瓜果蔬菜护肤 全球春季正当红,多吃绿色瓜果少患近视眼
3087,3087,0,吃蔬菜有啥好处？巧吃蔬菜不变老,养肝的食物有啥
1571,1571,0,减肥人士吃鸡蛋不应该排斥蛋黄,蛋黄小饼干做法是什么
298,298,1,安利7款减肥粥 解决各种肥胖体质,怎么解决肥胖体质
2473,2473,0,春季防晒的几个小窍门,养发有什么小窍门呢
2822,2822,0,吃东西的时间并不影响你减肥,吃东西不吸收营养咋办？
835,835,0,九个方法帮你快速去掉黑眼圈,不同颜色食物帮你减肥
2352,2352,0,春季减肥4大问 排毒帮你减体重,排毒的食物有哪些
52,52,1,葡萄+枸杞 女人补血的良品,适合女人补血的食品有哪些
124,124,1,节食减肥会引起这6个病症,哪些病症是节食减肥引起的
1834,1834,0,春季也需要防晒，分享几个小技巧,夏季必吃10种防晒食物
2117,2117,0,松露的产地来源,松露的营养有哪些
1482,1482,0,燕麦八宝饭 最简单的减肥饭,鱼形八宝饭的做法是什么呢？
3092,3092,0,吃蔬菜有啥好处？巧吃蔬菜不变老,东北有啥好吃的？
3154,3154,0,木耳的功效与作用及做法,木耳的食用方法有哪些
2919,2919,0,减肥吃鱼腥草，效果好不好？,鱼腥草什么味道
2428,2428,0,丰胸食材 多吃这些让您风韵犹存,江海风韵大酒楼的评价
2050,2050,0,石斛的5种吃法 美容又养生,石斛食用方法
792,792,0,一不留神就发胖：走路吃东西易发胖,拒绝身材走样饮食需要留神
2613,2613,0,8个饮食原则 让你怎么吃都不胖,怀孕期饮食
3164,3164,0,平菇的功效与作用及购买指南,平菇是发物么
75,75,1,想要祛斑？多吃绿豆百合,吃什么祛斑
510,510,1,8条平民减肥经验,哪些是平民减肥经验
2374,2374,0,黑木耳的功效与作用,什么是黑木耳
871,871,0,小小食盐功效多 美白祛痘好帮手,柠檬水是女性清肠好帮手
2839,2839,0,眼部皮肤脆弱 如何护眼？,护眼日常防范方法
586,586,1,银耳的营养价值,银耳的有怎样的营养价值
349,349,1,5个妙招 轻松解决皮肤出油,有哪些方法可以轻松解决皮肤出油
3168,3168,0,平菇的功效与作用及购买指南,平菇的做法
621,621,1,羊肚菌的营养价值及做法,羊肚菌的制作方法有哪些
3141,3141,1,西红柿可祛斑 你知道到吗,有哪些食物可以祛斑
123,123,1,节食减肥会引起这6个病症,节食减肥会引发哪些病症
1909,1909,0,减肥但想吃曲奇 全麦曲奇拯救你,多食全麦食品清肺润肺
3,3,1,山楂减肥汤 瘦成女神很简单,山楂怎么吃减肥？
1368,1368,0,想要美白 这些食物要少吃,这些零食儿童少吃
807,807,0,改善皮肤暗黄不做“黄脸婆”,产后这样吃远离黄脸婆
593,593,1,黑木耳的功效与作用,黑木耳的功效和作用有哪些
2104,2104,0,4款补血补气美味 让你美过大明星,补气补血食材有哪些
1226,1226,0,6种食物让你越吃越黑,饼干越硬越健康
2574,2574,0,8种食物能轻松消除小肚腩,3步帮你轻松减掉小肚腩
1049,1049,0,这些穴位经常按摩可以减肥,常按4个穴位养肾护肾
1550,1550,0,黑木耳饮食宜忌百科,饮用水其实也有宜忌小百科
1204,1204,0,喝汤可以增加饱腹感,减肥别吃太软烂可以增加饱腹感
248,248,1,两周都可以不重样 11种低卡路里早餐推荐,推荐不重样的早餐 11种低卡路里的
662,662,1,鸡枞菌的营养价值及做法,鸡枞菌的营养价值怎么样
2262,2262,0,5大减肥技巧 让你越吃越瘦,14种越吃越瘦的食物
2390,2390,0,适合减肥的九款低热量食物,减肥食谱
3177,3177,1,备孕推荐食谱,备孕饮食指南
1411,1411,1,黑木耳的功效与作用及食用方法,东北黑木耳有哪些功效
1003,1003,0,原来茶叶水能这样用来美容！,美容药膳
1334,1334,0,妙用5种食物 轻松改善粗糙肌肤,细腻肌肤吃出来
1950,1950,0,毛木耳-纺织和矿山工人很好的保健食品,科学保健8大保健禁区
2048,2048,0,吃菌类食物的科学方法,菌类的介绍
933,933,0,吃甜食7个技巧 让你不发胖,哪些蔬果吃了更容易发胖
2602,2602,0,牛肝菌的功效与作用及做法,牛肝菌的作用
2442,2442,0,平菇的营养价值及功效,平菇的做法
2023,2023,0,学会5招让你久坐不发胖,久坐易导致多种妇科病
1217,1217,0,自制美容养生粥 方便美味又健康,养生粥都有哪些？
3054,3054,0,羊肚菌的功效与作用,野生羊肚菌
770,770,1,草菇的功效与作用及食用宜忌,介绍下草菇的功效
2605,2605,0,牛肝菌的功效与作用及做法,美味牛肝菌
2894,2894,0,便宜材料 强力美白,美白防晒面膜
2253,2253,0,5大减肥技巧 让你越吃越瘦,让你越喝越瘦的神奇饮品
1073,1073,0,6种方法 选出优质胶原蛋白食物,自制芦荟胶的方法
1245,1245,0,16种果蔬让女性更美丽,果蔬可能残留哪些农药
2685,2685,0,春季美颜的4种食材,女性要美颜饮食要低盐
2761,2761,1,红菇的营养价值及功效,红菇的营养价值
535,535,1,明星好身材吃素吃出来,吃素可以吃出好身材来吗
1074,1074,0,6种方法 选出优质胶原蛋白食物,芦荟胶的好处与坏处是什么
1902,1902,0,女性每日一把葡萄干,葡萄干能煮粥吗
2332,2332,0,3大减肥食谱 高效燃脂瘦身,减肥瘦身水果有哪些
1451,1451,0,猴头菇的营养价值,猴头菇作用
135,135,1,女人每月“那几天”吃什么最健康养颜,推荐健康养颜的食物
3131,3131,0,减肥最佳食品——豆腐,减肥日程
3273,3273,0,这些食物是长肉的助手，减肥的敌人,填鸭式喂养光长肉不长个
1248,1248,0,16种果蔬让女性更美丽,果蔬拼盘
927,927,0,香菇的营养价值及做法,榆黄菇和香菇哪个种植比较好
3085,3085,1,喝3种茶去除口臭，与人交流不再尴尬,吃什么东西可以去除口臭
2386,2386,0,适合减肥的九款低热量食物,减肥日程
3064,3064,0,美容吃猪皮并不有效,油炸猪皮的简单做法
2703,2703,0,上班族运动减肥 别犯这4种错误,减肥食品
1767,1767,0,肠道顺自然瘦！每天1杯果汁养成易瘦体质,6种食物清洁肠道
735,735,1,金针菇的营养价值,介绍下金针菇的营养价值
2280,2280,0,轻易祛斑小妙招：丝瓜调和蜂蜜,吃什么水果祛斑？
3171,3171,0,平菇的功效与作用及购买指南,蚝油焖平菇
423,423,1,为爱美女性搭配合理美容餐,如何合理搭配美容餐
2276,2276,0,轻易祛斑小妙招：丝瓜调和蜂蜜,有哪些食物可以祛斑
868,868,0,晚上怎么吃水果帮助减肥？,减肥计划
114,114,1,六大健康食物给爱美的你,吃什么食物健康
3038,3038,1,三种食物吃出水嫩肌肤,细腻肌肤吃出来
2285,2285,0,美肤瘦身多吃豆类食品,推荐用水果蔬菜将美肤进行到底
1884,1884,0,春季减肥 9种吃法让你越吃越瘦,越吃越瘦的东西有哪些呢
1531,1531,1,竹荪的营养价值,竹荪的作用
1246,1246,0,16种果蔬让女性更美丽,哪些果蔬能瘦身
2015,2015,0,晚上这样吃，只会越来越瘦,吃什么能瘦胸呢？
2246,2246,0,十种食品 打造零毛孔美人,5个护肤小日常毛孔去无踪
766,766,1,香菇健康饮食百科,怎样食用香菇制作健康的饮食食谱
160,160,1,天然刮油减脂食物有哪些呢？,推荐的天然刮油减脂食物
1191,1191,0,这样吃粗粮 不用运动也能变瘦,让你变瘦的九种食物
174,174,1,青苹果防止肥胖,哪些水果可以防止肥胖
870,870,0,晚上怎么吃水果帮助减肥？,减肥蔬菜什么蔬菜减肥
549,549,1,黑木耳的功效与作用及食用方法,黑木耳的功效有哪些
2420,2420,0,吃白菜能减肥？ 这样吃才有效,有补钙之效的家常菜
2118,2118,0,松露的产地来源,白松露的吃法
1853,1853,0,香蕉热量低 但减肥不可取,用果汁代替水果不可取
553,553,1,黑木耳的功效与作用及食用方法,告诉我黑木耳的功效和食用方法
1090,1090,0,八种补血菜 养出好气色,13款饮品喝出好气色
2083,2083,0,2款花茶就能喝出好气色 让你人比花娇,花娇煲汤需要放哪些材料
1147,1147,0,上班族减掉赘肉的小妙招,预防冬季发胖有妙招
2478,2478,0,春季防晒的几个小窍门,饮食减肥小窍门
3041,3041,1,三种食物吃出水嫩肌肤,增加肌肤弹性食物
2396,2396,0,吃素减肥不可取,用果汁代替水果不可取
1102,1102,0,使用护发素要看发质 用错易长头皮屑,这些食物一吃就易长皱纹！
3033,3033,0,草莓沙拉可减肥 酸奶代替沙拉酱,水果沙拉酱的做法
2640,2640,0,这种减肥泡菜 三分钟搞定,便宜食物搞定毛孔粗大
185,185,1,每天坚持吃蔬果 轻松瘦身,吃什么可以瘦身
2082,2082,1,饮食减肥大全,减肥蔬菜什么蔬菜减肥
2186,2186,0,皮肤会变黑全是因为它们,吃什么可以头发变黑
1036,1036,0,春季护肤怎么做 补充维C能保湿,维C多的水果有哪些
1156,1156,0,甜味剂会让人肥胖 你还在喝无糖饮料吗？,教你分辨甜味剂
478,478,1,4种祛斑食谱 轻松去褐斑,哪些食物可以轻松去褐斑
1845,1845,0,山楂减肥汤 瘦成女神很简单,山楂红薯粥的做法
1558,1558,0,番茄瘦身法,减肥瘦身果有哪些功效
1757,1757,0,羊肚菌的营养价值及做法,羊肚菌做法
1598,1598,0,金针菇的功效与作用,金针菇的营养
436,436,1,2款花茶就能喝出好气色 让你人比花娇,推荐喝出好气色的花茶
2957,2957,0,女人爱自己 经期喝玫瑰花茶可缓解抑郁,玫瑰花茶的做法
2730,2730,0,4个小窍门帮你快速瘦掉大粗腿,帮你挑选减压食品
2384,2384,0,减肥食谱可不能少了苦瓜,苦瓜的价值有哪些
2696,2696,0,少吃多餐可以减肥 如何吃才最减肥,员工餐菜谱
476,476,1,改善干燥 春季多吃胡萝卜,推荐一些改善干燥的食物
2738,2738,1,鸡腿菇的做法及营养价值,鸡腿菇的做法
3211,3211,0,减肥沙拉那种酱好 这三种酱可代替沙拉酱,酱烧罗非鱼
2139,2139,0,秋季美白保湿面膜,什么水果保湿效果好呢
320,320,1,掌握5种技巧 让面膜效果加倍,哪些技巧能让让面膜效果加倍
3070,3070,1,怎么去鱼尾纹 用这物就能解决,去除鱼尾纹的饮食秘方
2997,2997,0,苹果牛奶减肥法 让你2天瘦7斤,吃什么能瘦胸呢？
1357,1357,0,饭前喝点水就能瘦？,太瘦的人应该吃什么比较好？
568,568,1,乳酸菌的作用与功效,乳酸菌有什么功效
321,321,1,掌握5种技巧 让面膜效果加倍,推荐面膜效果加倍的技巧
3107,3107,0,两周都可以不重样 11种低卡路里早餐推荐,早餐咸的有哪些
1809,1809,0,5个保湿小技巧帮你养出Q弹肌,消化不良这些茶能帮你
2068,2068,0,经常染发？你需要这4种食物,有哪些中草药具有乌发染发的功效
1434,1434,0,减肥不吃早餐的五大危害,减肥蔬菜
26,26,1,四招轻松去黑头,怎么能去黑头？
1879,1879,0,低脂食品不能减脂，还会使人发胖,五种食物助中年人减脂
2127,2127,0,肌肤不均匀 改善肌肤从这入手,紧致肌肤用什么方法最好
958,958,0,想减肥？米饭应该这么吃,黄焖鸡米饭有哪些品牌
2336,2336,0,3大减肥食谱 高效燃脂瘦身,果蔬汁减肥瘦身有哪些？
1656,1656,0,春季减肥要注意 运动为主节食为辅,运动节食减肥计划方法
2265,2265,0,牙齿美白小窍门 让你笑口常开,十种食物美白牙齿，让您笑口常开
2832,2832,0,晚餐饮食减肥的5个技巧,减肥餐
2130,2130,0,干巴菌的做法,干巴菌的意思
2937,2937,0,节食减肥会引起这6个病症,老年人适当节食有益长寿
1176,1176,0,女人每月“那几天”吃什么最健康养颜,减肥养颜食谱有哪些？
0,0,1,喝豆浆减肥？教你科学减肥,减肥期能喝豆浆吗？
2737,2737,0,鸡腿菇的做法及营养价值,鸡腿菇不能和什么一起吃
2201,2201,0,治疗女性月经量少的5大健康食谱,糖尿病人食谱
2888,2888,0,润肤养发四季百搭美食 这种食物真的有,哪些食物养肾呢
1658,1658,0,春季减肥要注意 运动为主节食为辅,保苗条有效节食6秘诀
1537,1537,0,蔡依林三个苗条魔咒,这么吃苗条不长肉
300,300,1,8种青春永驻妙招 让你永远18岁,青春永驻有什么妙招
2044,2044,0,春季皮肤常见问题 3个对策各个击破,改善女性肾虚食疗对策
2770,2770,0,十二个最快减肥秘籍法,减肥计划
3270,3270,0,这些食物是长肉的助手，减肥的敌人,三餐这么吃苗条不长肉
750,750,1,平菇的营养价值及功效,平菇有什么功效
1749,1749,0,7款不可错过的饮食小偏方 让你轻松瘦下来,能治疗高血压的偏方有哪些
2233,2233,0,每天吃点菌类食品，营养加分,"给宝宝吃点""味冲""食物"
1865,1865,0,春季减肥的九个方法,减肥食品
760,760,1,红菇的营养价值及功效,红菇有哪些营养价值和功效
973,973,0,十种明星最信赖瘦身法,鸡蛋瘦身减肥
809,809,0,改善皮肤暗黄不做“黄脸婆”,5大美白方告别黄脸婆
1309,1309,0,小美牛肝菌的简介,鲜牛肝菌的做法
1646,1646,0,狂吃减压易发胖 选对食物没问题（）,新生儿易发哪些疾病？
3233,3233,0,主妇秘笈:减肥就要这样做饭,家庭做饭
754,754,1,红菇的营养价值及功效,红菇有什么营养价值
1691,1691,0,加餐4个小技巧 减肥成功吃得好,加餐小技巧瘦身没负担
1250,1250,0,女性脱发不可怕 这6个方法能帮到你,这些“营养食物”太可怕
3015,3015,0,春夏多吃三种食物易排毒,什么是排毒
3089,3089,0,吃蔬菜有啥好处？巧吃蔬菜不变老,动力鸡车有啥特色?
560,560,1,蘑菇的功效与作用及营养价值,蘑菇的作用有哪些
776,776,1,竹荪的营养价值及食疗偏方,竹荪的营养价值有哪些
2977,2977,0,"好肤色也可以""喝""出来 8款适合女性的滋补汤",滋补火锅有哪些？
1839,1839,0,5个注意事项 将染发伤害降到最低,有哪些中草药具有乌发染发的功效
182,182,1,一不留神就发胖：走路吃东西易发胖,推荐不容易发胖的食物
2182,2182,0,豆腐搭配牛奶 轻松瘦身,果蔬汁减肥瘦身有哪些？
1730,1730,0,银耳的功效与作用,银耳有哪些做法?
1575,1575,0,减肥人士吃鸡蛋不应该排斥蛋黄,婴儿蛋黄的做法有哪些?
1171,1171,0,教你8个怎么吃都不胖的妙招,教宝宝学习咀嚼有哪些步骤
2668,2668,0,巧克力是美容神器 但是不宜多吃,抗癌神器——12种水产品
1183,1183,0,女人每月“那几天”吃什么最健康养颜,美容养颜茶有哪些
962,962,0,美味芦笋15日完美瘦身,芦笋的几种食用方法
1705,1705,0,电脑族美容 轻松祛斑小妙招,柠檬水可以祛斑美容
1315,1315,0,竹荪的功效与作用,竹荪究竟是什么
166,166,1,3大减肥食谱 高效燃脂瘦身,吃什么可以高效燃脂瘦身
2039,2039,0,春季皮肤常见问题 3个对策各个击破,5大饮食对策对抗发胖
87,87,1,轻易祛斑小妙招：丝瓜调和蜂蜜,推荐祛斑的方法美食
2289,2289,0,美肤瘦身多吃豆类食品,水果美肤成效排行榜
2830,2830,0,晚餐饮食减肥的5个技巧,减肥日程
2411,2411,0,松茸的功效及做法,松茸可以养殖吗
2733,2733,0,鸡腿菇的做法及营养价值,鸡腿菇的做法大全
3122,3122,0,口蘑的功效与作用,口蘑是什么
990,990,0,清肠素食 肠道变得更年轻,吃什么可以加速肠道蠕动
1606,1606,0,鸡蛋去黑头 因人而异有点儿用,茶能“解毒”但因人而异
1991,1991,0,3月怎能不减肥 3种可以减肥的食物,减肥日程
1362,1362,0,想要美白 这些食物要少吃,白细胞少吃什么食物好
2479,2479,0,春季防晒的几个小窍门,冰箱去异味小窍门有哪些呢
517,517,1,消灭肚腩的四个饮食方案,消灭肚腩有什么饮食方案
2601,2601,0,牛肝菌的功效与作用及做法,牛肝菌那个品种最好
879,879,0,小小食盐功效多 美白祛痘好帮手,3类食物妈妈断奶好帮手
1608,1608,0,鸡蛋去黑头 因人而异有点儿用,水果的选择其实也可以因人而异
2115,2115,0,松露的产地来源,有关松露的食用方法
1782,1782,0,减肥美容冬瓜饮的自制方法,冬瓜配什么好吃
1004,1004,0,原来茶叶水能这样用来美容！,对症美容
2033,2033,0,五种瘦身早餐 让你轻松瘦下来,水果食疗让你大开眼界
920,920,0,香菇的营养价值及做法,香菇的种植需要哪些条件
1601,1601,0,教你两种药粥食疗方消灭轻度脂肪肝,夏季养生调理药粥
622,622,1,羊肚菌的营养价值及做法,怎样制作才能更好的提高羊肚菌的营养价值
632,632,1,银耳的功效与作用,银耳的功效有哪些
1821,1821,0,5时段喝水才能真正瘦下来,喝水的时间介绍
2783,2783,0,盘点减肥要远离的四大食物,减肥日程
2234,2234,0,每天吃点菌类食品，营养加分,吃点零食也养颜
3281,3281,0,消除小肚腩的10种食物,睡前睡后赶走小肚腩
374,374,1,教你8个怎么吃都不胖的妙招,怎么吃都不胖有哪些妙招
1546,1546,0,蔡依林三个苗条魔咒,十大原则拥有苗条身材
1800,1800,0,上这5种肉最适合减肥的人吃,减肥减肥减肥减肥
713,713,1,牛肝菌的功效与作用及做法,牛肝菌的功效有哪些
1308,1308,0,小美牛肝菌的简介,牛肝菌的做法
263,263,1,吃出小蛮腰的瘦身餐（）,我想拥有小蛮腰吃哪些瘦身餐好
3169,3169,0,平菇的功效与作用及购买指南,平菇培养基
1304,1304,0,小美牛肝菌的简介,牛肝菌的作用
1556,1556,0,黑木耳饮食宜忌百科,食物的宜忌原则
2691,2691,0,少吃多餐可以减肥 如何吃才最减肥,减肥餐
2658,2658,0,帮助你快速减肥的五个方法,减肥食谱
617,617,1,干巴菌的做法,怎么样制作干巴菌
895,895,0,4种方法教会你喝柠檬水减肥,减肥食谱
1472,1472,0,加速衰老的6种行为,哪些食物是延缓衰老的
1193,1193,0,这样吃粗粮 不用运动也能变瘦,变瘦瘦十一种蔬菜帮助你
1288,1288,0,3天果汁排毒减肥法,排毒效果
653,653,1,青头菌的做法及功效,怎样制作才能更好的提高青头菌的功效
10,10,1,牢记生活细节 甩掉你的小肚腩,怎么甩掉小肚腩？
2291,2291,0,美肤瘦身多吃豆类食品,瘦身美肤最给力的食物
70,70,1,适合减肥的九款低热量食物,哪些食物热量低适合减肥时吃
128,128,1,低脂食品不能减脂，还会使人发胖,低脂食品可以减脂吗
645,645,1,松茸的功效及做法,松茸的功效有哪些
1455,1455,0,饭前吃蔬菜有助减肥,减肥餐
191,191,1,10种食物排毒消脂 加倍享瘦,推荐加倍享瘦的食物
1899,1899,0,女性每日一把葡萄干,葡萄干功效超乎想象
1402,1402,0,8条平民减肥经验,减肥减肥减肥减肥
492,492,1,甜味剂会让人肥胖 你还在喝无糖饮料吗？,甜味剂有哪些危害
2704,2704,0,上班族运动减肥 别犯这4种错误,减肥餐
974,974,0,十种明星最信赖瘦身法,瘦身减肥食谱有哪些
3219,3219,0,减肥沙拉那种酱好 这三种酱可代替沙拉酱,自制烤肉酱
1724,1724,0,银耳的功效与作用,银耳的做法有几种
1712,1712,0,怎样防止乳防下垂,子宫下垂吃什么菜比较好
2371,2371,1,黑木耳的功效与作用,黑木耳的营养
2135,2135,1,干巴菌的做法,干巴菌的做法大全
758,758,1,红菇的营养价值及功效,红菇的功效有哪些
2225,2225,0,消灭肚腩的四个饮食方案,这样吃最容易长肚腩
1339,1339,0,妙用5种食物 轻松改善粗糙肌肤,紧致肌肤的方法
907,907,0,脸上有斑点怎么办？常吃3食物能祛斑,吃什么食物可以祛斑
1180,1180,0,女人每月“那几天”吃什么最健康养颜,有哪些常见美容养颜羹汤
801,801,0,黑木耳瘦身食谱简单DIY,黑木耳的营养
994,994,0,清肠素食 肠道变得更年轻,吃什么水果可以清肠道
1142,1142,0,要是减肥 喝水都能瘦,喝水过多的坏处有哪些
1100,1100,0,使用护发素要看发质 用错易长头皮屑,警惕！这样吃最易长肚腩
2263,2263,0,牙齿美白小窍门 让你笑口常开,牙齿美白小窍门让你笑口常开
2200,2200,0,治疗女性月经量少的5大健康食谱,孕期食谱
677,677,1,平菇的营养成分及药用价值,平菇的营养成分有哪些
1130,1130,0,皮肤保养的饮食宜忌 让你的皮肤吹弹可破,老年人饮食宜忌有哪些
2059,2059,0,一日吃仨枣保健又美容,果汁美容
1681,1681,0,适量蔬果汁 排毒又美容,蔬果的有什么营养价值
1081,1081,0,6种方法 选出优质胶原蛋白食物,鱼鳔胶是什么呢
