,Unnamed: 0,match,q1,q2
2956,2956,0,女人爱自己 经期喝玫瑰花茶可缓解抑郁,玫瑰花茶作用有哪些？
682,682,1,香菇的功效与作用,香菇有什么功效
1030,1030,0,推荐四款蔬菜汁美容去斑点,常喝蔬菜汁有益健康
2532,2532,0,吃蔬菜沙拉可以减肥吗 原来是这么回事儿,DIY健康蔬菜沙拉
483,483,1,控制饭量 保持体重,推荐一些控制饭量又保持体重的方法
380,380,1,苹果牛奶减肥法 让你2天瘦7斤,推荐一些减肥方法
183,183,1,加速衰老的6种行为,哪些行为会加速衰老
1564,1564,0,零负担减肥食物 享瘦又健康,享“瘦”冰淇淋适度最重要
3098,3098,0,怎么吃都不长肉？太瘦的人要当心了,当心这10种有毒蔬菜
2240,2240,0,每天吃点菌类食品，营养加分,高中生可以吃点什么益智补脑？
2252,2252,0,十种食品 打造零毛孔美人,毛孔粗大吃什么水果好
1336,1336,0,妙用5种食物 轻松改善粗糙肌肤,紧致肌肤吃什么中药
1089,1089,0,祛斑滋补汤 帮你祛除老年斑,吃什么食物可以祛斑
1306,1306,0,小美牛肝菌的简介,牛肝菌是什么
73,73,1,头发总出油怎么办？教你护理小妙招,油性发质有什么好的护理方法吗
3235,3235,0,主妇秘笈:减肥就要这样做饭,用砂锅做饭和焖锅做饭有什么区别
303,303,1,6款食物让你秀出小蛮腰,小蛮腰是吃了什么食物塑造的
2377,2377,0,减肥食谱可不能少了苦瓜,苦瓜的做法有哪些
2636,2636,0,牛肝菌的营养价值,牛肝菌是什么呢
1170,1170,0,教你8个怎么吃都不胖的妙招,处理器天梯图，教您笔记本电脑处理器哪种好
2086,2086,0,经期减肥法 确有效果还是商家炒作,经期补血吃什么
656,656,1,鸡腿菇的做法及营养价值,鸡腿菇要怎么做
2648,2648,0,想要祛斑？多吃绿豆百合,祛斑的食物
194,194,1,饭前喝点水就能瘦？,吃饭之前喝水有什么帮助？
1915,1915,0,减肥但想吃曲奇 全麦曲奇拯救你,健康饮食多食用全麦食品！
2985,2985,0,草菇的功效与作用及食用宜忌,学龄前儿童食物宜忌
2506,2506,0,减肥要健康 10种小秘方帮你解决,不同颜色食物帮你减肥
176,176,1,巧克力是美容神器 但是不宜多吃,巧克力有什么功效
680,680,1,香菇的功效与作用,香菇有什么作用
3081,3081,1,喝3种茶去除口臭，与人交流不再尴尬,喝什么可以去口臭
1297,1297,0,六种可以让你急速减肥的蔬菜,减肥食谱
775,775,1,草菇的功效与作用及食用宜忌,草菇与什么食物搭配，才能更好的发挥草菇的功效和作用
2741,2741,0,头发总出油怎么办？教你护理小妙招,生活小妙招
2964,2964,0,香菇的功效与作用,香菇的营养
2637,2637,0,这种减肥泡菜 三分钟搞定,节后消化不良8招搞定
1083,1083,0,祛斑滋补汤 帮你祛除老年斑,有哪些食物可以祛斑
1035,1035,0,春季护肤怎么做 补充维C能保湿,吃什么水果补充维C呢？
661,661,1,毛木耳-纺织和矿山工人很好的保健食品,毛木耳可以做纺织和矿山工人的保健食品吗
845,845,0,调理肠胃 赶走便秘的4种食物,治便秘食谱有哪些
579,579,1,吃菌类食物的科学方法,吃菌类食物要注意什么
1801,1801,0,上这5种肉最适合减肥的人吃,减肥食谱
2271,2271,0,减肥食物 16种减肥食物排行榜,减肥蔬菜
1485,1485,0,燕麦八宝饭 最简单的减肥饭,罐头八宝饭包括什么
1198,1198,0,喝汤可以增加饱腹感,哪些食物容易产生饱腹感
2284,2284,0,美肤瘦身多吃豆类食品,厨房中的美肤计划
1490,1490,0,燕麦八宝饭 最简单的减肥饭,八宝饭制作
964,964,0,美味芦笋15日完美瘦身,芦笋制作的食品有哪些
207,207,1,核桃新吃法 让你的头发又黑又亮,又黑又亮的头发是吃了什么
1045,1045,0,这些穴位经常按摩可以减肥,肩周炎的按摩穴位
364,364,1,想要更加苗条 没事喝点儿茶,怎么让身材更加苗条
2911,2911,0,减肥吃鱼腥草，效果好不好？,鱼腥草有什么作用
2047,2047,0,吃菌类食物的科学方法,这是什么菌类
2918,2918,0,减肥吃鱼腥草，效果好不好？,鱼腥草有哪几种吃法
1744,1744,0,菠萝帮你清体美容消脂,帮你挑选减压食品
275,275,1,留住芳华 只需这6款高颜值粥品,有哪些高颜值粥品，能留住芳华
2776,2776,0,白醋洗脸 4种方法让你变白变美,吃了就变美的八种驻颜食物
597,597,1,金针菇的功效与作用,金针菇有怎样的功效和作用
562,562,1,蘑菇的功效与作用及营养价值,蘑菇的营养价值有哪些
2693,2693,0,少吃多餐可以减肥 如何吃才最减肥,三餐营养食谱有哪些
372,372,1,春季防晒的几个小窍门,推荐一些防晒小窍门
2955,2955,0,女人爱自己 经期喝玫瑰花茶可缓解抑郁,玫瑰花茶的喝法有哪些
2466,2466,0,为爱美女性搭配合理美容餐,月子餐的饮食禁忌有哪些
2206,2206,0,治疗女性月经量少的5大健康食谱,减肥食谱
2929,2929,0,香菇健康饮食百科,榆黄菇和香菇哪个种植比较好
130,130,1,喝汤可以增加饱腹感,如何增加饱腹感
1789,1789,0,减肥美容冬瓜饮的自制方法,炒冬瓜的做法有哪些？
2372,2372,0,黑木耳的功效与作用,哪些女星被爆黑木耳
3260,3260,0,盘点5大瘦脸食物 轻松吃出V形脸,喝酒的禁忌盘点
215,215,1,白醋洗脸 4种方法让你变白变美,白醋洗脸有什么功效
2319,2319,0,敏感肌MM春季护肤注意5件事,酒后不能做的5件事
3077,3077,1,喝3种茶去除口臭，与人交流不再尴尬,小孩口臭吃什么好？
2172,2172,0,掌握5种技巧 让面膜效果加倍,美白面膜：苹果面膜
805,805,0,黑木耳瘦身食谱简单DIY,黑木耳沾什么好吃
58,58,1,祛斑吃什么？ 3种果蔬帮你忙,果蔬可以祛斑吗
1518,1518,0,吃菌子的坏处,近视有什么坏处
692,692,1,猴头菇的营养价值,猴头菇有怎么样的营养价值
103,103,1,肌肤不均匀 改善肌肤从这入手,改善肌肤从哪入手
987,987,0,清肠素食 肠道变得更年轻,吃什么食物对肠道好呢
963,963,0,美味芦笋15日完美瘦身,芦笋的做法有哪些？
1910,1910,0,减肥但想吃曲奇 全麦曲奇拯救你,健康从全麦早餐开始
2960,2960,1,女人爱自己 经期喝玫瑰花茶可缓解抑郁,玫瑰花茶的药性有哪些？
817,817,0,吃出来的俏丽容颜 4道药膳来美容,民间药膳方法有哪些？
2148,2148,0,6款番茄减肥食谱 让你吃出好身材,饮食20件事让你身体差
1257,1257,0,6种食物 让你“吃”出好身材,六类食物塑造完美身材
2690,2690,0,少吃多餐可以减肥 如何吃才最减肥,苹果餐减肥法
1439,1439,0,8款美容面膜DIY,美白面膜：小黄瓜面膜
319,319,1,春季护肤必须要知道这4点,春季护肤要注意哪几点
932,932,0,咖啡加盐 去苦味助减肥,咖啡加盐可以壮阳吗
2917,2917,0,减肥吃鱼腥草，效果好不好？,鱼腥草的吃法有哪些
1346,1346,1,鸡油菌的做法及功效,鸡油菌的主要功效
798,798,0,一不留神就发胖：走路吃东西易发胖,留神！吃着不甜的高糖食物
1236,1236,0,核桃新吃法 让你的头发又黑又亮,鱼生的吃法有哪些
2362,2362,0,女人必备的黄金食物,养生必备3字秘籍
1240,1240,0,16种果蔬让女性更美丽,降血脂果蔬有哪些？
2787,2787,0,盘点减肥要远离的四大食物,减肥食谱
1072,1072,0,6种方法 选出优质胶原蛋白食物,芦荟胶的功效是什么？
2453,2453,0,秋季护肤 美白防晒不能停,防晒食物吃什么？
498,498,1,这些食物是长肉的助手，减肥的敌人,哪些食物吃了长肉
415,415,1,怎样防止乳防下垂,乳防下垂怎么防止
3005,3005,0,鸡枞菌的营养价值及做法,小孩营养早餐有哪些
1692,1692,0,加餐4个小技巧 减肥成功吃得好,婴幼儿不宜常用糕点当加餐
2382,2382,0,减肥食谱可不能少了苦瓜,苦瓜吃法
558,558,1,蘑菇的功效与作用及营养价值,蘑菇的功效有哪些
2176,2176,0,掌握5种技巧 让面膜效果加倍,美白面膜：优酪乳面膜
1389,1389,0,减肥的人注意：4种吃法扰乱新陈代谢,椰蓉吃法
3123,3123,0,蘑菇的功效与作用及营养价值,什么的蘑菇？
283,283,1,石斛的5种吃法 美容又养生,石斛有哪些吃法既美容又养生
1764,1764,0,猪尾凤爪香菇汤美容丰胸效果佳,山药猪尾烫的用处
2219,2219,0,五款茶饮 去掉小肚腩,果蔬减肥法让你远离小肚腩
2166,2166,0,秋季如何快速全身美白,美白紧肤面膜
3307,3307,0,王牌减肥食物超燃脂 简单吃吃狂掉肉,强直性脊柱炎吃吃什么东西比较好？
1850,1850,0,山楂减肥汤 瘦成女神很简单,山楂可以做成哪些美食
957,957,0,想减肥？米饭应该这么吃,秘制排骨米饭
2361,2361,0,女人必备的黄金食物,厨房必备调料
2213,2213,0,5款冠军茶 喝茶变苗条,苗条身材是因为吃的杂？
926,926,0,香菇的营养价值及做法,香菇种类
2283,2283,0,美肤瘦身多吃豆类食品,十大天然美肤水果
2077,2077,0,饮食减肥大全,减肥减肥减肥减肥
1263,1263,0,6种食物 让你“吃”出好身材,根据身材选择最适食物
3202,3202,0,女性需要远离的8大体臭食物,长痘痘远离这些食物
886,886,0,美容养颜 教你“喝”掉斑点,养颜花草茶配方有哪些
489,489,1,减肥应该吃什么 了解热量科学减肥,怎么热量科学减肥 应该吃什么
3194,3194,0,初秋养肺食疗法 不容忽视的养生法则,学生用眼过度保护视力不容忽视
1797,1797,0,上这5种肉最适合减肥的人吃,减肥日程
1022,1022,0,减肥2神器 香蕉和酸奶,酸奶减肥食谱有哪些
2990,2990,0,苹果牛奶减肥法 让你2天瘦7斤,吃什么可以瘦臀部
1280,1280,0,蜂蜜生姜水防老年斑,淡化老年斑，6种食物最有效
1529,1529,0,吃水果来减肥的2个误区,女性养生补血的常见误区有哪些？
1954,1954,0,芝麻花生帮女人身材升Cup！,芝麻的营养价值
2877,2877,0,喝豆浆减肥？教你科学减肥,豆浆减肥法
1654,1654,0,平菇的做法及功效,蚝油焖平菇
3062,3062,0,美容吃猪皮并不有效,猪皮都可以做什么美食
3203,3203,0,女性需要远离的8大体臭食物,巧饮食远离节后综合症
730,730,1,口蘑的功效与作用,口蘑有哪些作用和功效
1057,1057,0,每天坚持吃蔬果 轻松瘦身,瘦身减肥食谱有哪些
3022,3022,0,玉米的养颜功效,养颜花草茶配方有哪些
777,777,1,竹荪的营养价值及食疗偏方,竹荪有哪些营养价值
2507,2507,0,减肥要健康 10种小秘方帮你解决,帮你挑选减压食品
2827,2827,0,吃东西的时间并不影响你减肥,睡前吃东西的危害有哪些
404,404,1,多吃菌菇 能够美容养出好皮肤,菌菇有什么功效
2149,2149,0,6款番茄减肥食谱 让你吃出好身材,4款食谱让你轻松补铁
81,81,1,润肤养发四季百搭美食 这种食物真的有,哪些美食可以润肤养发
325,325,1,清肠素食 肠道变得更年轻,如何使肠道变得更年轻
1115,1115,0,这些食物只吃不胖！减肥族请保存,减肥食品
2630,2630,1,牛肝菌的营养价值,牛肝菌的作用
1032,1032,0,推荐四款蔬菜汁美容去斑点,减肥蔬菜汁行吗。
2698,2698,0,少吃多餐可以减肥 如何吃才最减肥,三餐美人计
1587,1587,0,银耳饮食宜忌百科,老年人饮食宜忌有哪些
2940,2940,0,想要更加苗条 没事喝点儿茶,要养生喝点儿茶
1144,1144,0,6种常见水果让你瘦成瓜子脸,改变1个饮食习惯让你瘦成一道闪电
3173,3173,1,备孕推荐食谱,女性备孕吃什么好
1750,1750,0,健康减肥 6种蔬菜帮你快速瘦身,减肥瘦身水果有哪些
1267,1267,0,平菇的营养成分及药用价值,平菇是发物么
154,154,1,5个保湿小技巧帮你养出Q弹肌,怎么养出Q弹肌
2520,2520,0,减肥效果最佳的3个时间,减肥食品
742,742,1,地耳的功效与饮食宜忌,地耳有怎么的功效
773,773,1,草菇的功效与作用及食用宜忌,草菇不可以和什么食物搭配
2561,2561,0,3款美容食谱,营养食谱
2286,2286,0,美肤瘦身多吃豆类食品,自制美肤面膜
289,289,1,食物这样吃 可以让你快速瘦身,快速瘦身的食物有哪些改怎么吃
1893,1893,0,女性每日一把葡萄干,葡萄干做法
1533,1533,0,竹荪的营养价值,竹荪种植技术
212,212,1,喝茶能够祛斑？要怎样喝呢？,怎么喝茶能够祛斑
3116,3116,0,口蘑的功效与作用,炒口蘑的做法
199,199,1,香蕉8大益处 健体亦美容,吃什么可以健体亦美容
332,332,1,五种瘦身早餐 让你轻松瘦下来,有几种早餐可以轻松瘦下来
3147,3147,1,西红柿可祛斑 你知道到吗,吃什么食物可以祛斑
3121,3121,0,口蘑的功效与作用,炒口蘑的调料：
734,734,1,金针菇的营养价值,金针菇的营养价值怎么样
2452,2452,0,秋季护肤 美白防晒不能停,哪些食物能防晒
2275,2275,0,轻易祛斑小妙招：丝瓜调和蜂蜜,祛斑吃什么食物调理
1330,1330,0,松露是什么,松露的营养有哪些
1815,1815,0,5个保湿小技巧帮你养出Q弹肌,帮你挑选减压食品
837,837,0,竹荪的营养价值及食疗偏方,竹荪是什么
1911,1911,0,减肥但想吃曲奇 全麦曲奇拯救你,男人都该爱上全麦早餐
1095,1095,0,八种补血菜 养出好气色,好方法让女人拥有好气色
1381,1381,0,明星好身材吃素吃出来,这样吃素才健康
1403,1403,0,8条平民减肥经验,减肥食谱
573,573,1,香菇：排毒抗癌，益气治风,食用香菇有什么好处
783,783,1,银耳饮食宜忌百科,银耳不能与什么食物搭配
2100,2100,0,科学减肥 需要三管齐下,减肥蔬菜
747,747,1,平菇的营养价值及功效,平菇有什么营养价值
1272,1272,0,平菇的营养成分及药用价值,平菇培养基
456,456,1,豆腐搭配牛奶 轻松瘦身,豆腐搭配牛奶可以瘦身吗
1916,1916,0,肥胖的真正敌人是谁？,不当的饮食方式导致肥胖
600,600,1,小美牛肝菌的简介,小美牛肝菌是什么
473,473,1,玉米的养颜功效,哪些食物有养颜的功效
684,684,1,香菇的功效与作用,香菇有怎样的作用和功效
220,220,1,加餐4个小技巧 减肥成功吃得好,如何加餐，但又不耽误减肥
2497,2497,0,染发的4大危害 一不小心可致癌,染发避开这4条否则会毁容
1354,1354,0,饭前喝点水就能瘦？,一瘦再瘦的零食清单
891,891,0,4种方法教会你喝柠檬水减肥,减肥日程
2009,2009,0,晚上这样吃，只会越来越瘦,一瘦再瘦的零食清单
463,463,1,原来茶叶水能这样用来美容！,怎么用茶叶水美容
2000,2000,0,瘦腰课程表 吃着减赘肉,传说中的健康食品让你赘肉横生
2503,2503,0,减肥要健康 10种小秘方帮你解决,食物帮你除臭
1311,1311,0,竹荪的功效与作用,竹荪是什么
3056,3056,1,羊肚菌的功效与作用,羊肚菌的主要价值
3095,3095,0,怎么吃都不长肉？太瘦的人要当心了,鱼未煮熟当心要命
1067,1067,0,5个妙招 轻松解决皮肤出油,消除口臭有妙招
794,794,0,一不留神就发胖：走路吃东西易发胖,孕期进补需样样留神
221,221,1,吃甜食7个技巧 让你不发胖,怎么吃甜食不发胖
2476,2476,0,春季防晒的几个小窍门,小窍门买鱼虾
1585,1585,0,银耳饮食宜忌百科,学龄前儿童食物宜忌
2962,2962,0,香菇的功效与作用,香菇面筋的做法有哪些
635,635,1,双色牛肝菌简介,什么是双色牛肝菌
605,605,1,鸡油菌的做法及功效,鸡油菌有怎么样的功效
3057,3057,0,羊肚菌的功效与作用,羊肚菌的做法
2325,2325,0,喝点红豆水帮你消肿瘦脸,吃什么食物可以瘦脸？
803,803,0,黑木耳瘦身食谱简单DIY,东北黑木耳有哪些功效
1584,1584,0,银耳饮食宜忌百科,咳嗽宜忌原则
3113,3113,0,两周都可以不重样 11种低卡路里早餐推荐,早餐搭配
1347,1347,1,鸡油菌的做法及功效,鸡油菌做法是什么？
2358,2358,0,女人必备的黄金食物,营养午餐必备食物
170,170,1,7个食疗小偏方吃脸上斑斑点点,哪些食物吃了脸上会斑斑点点
2485,2485,0,青苹果防止肥胖,青苹果是什么味道？
85,85,1,怎么吃都不长肉？太瘦的人要当心了,太瘦了，怎么吃都不长肉怎么办
3188,3188,0,10款丰胸汤 吃出C杯胸不是梦,丰胸是什么意思
1168,1168,0,秋季食物美白偏方,能治疗高血压的偏方有哪些
2469,2469,0,为爱美女性搭配合理美容餐,排毒瘦身餐
1342,1342,0,妙用5种食物 轻松改善粗糙肌肤,敏感肌肤自制面膜
741,741,1,猴头菇的功效与作用,猴头菇有哪些作用和功效
2196,2196,0,酸奶加点料 甩掉小肚腩,易发胖长小肚腩饮食
630,630,1,银耳的功效与作用,银耳的作用有哪些
743,743,1,地耳的功效与饮食宜忌,地耳的功效是什么
2245,2245,0,十种食品 打造零毛孔美人,4种食物解决毛孔问题
3031,3031,0,草莓沙拉可减肥 酸奶代替沙拉酱,沙拉酱制作
2979,2979,0,"好肤色也可以""喝""出来 8款适合女性的滋补汤",家禽中男人吃哪样更滋补
2592,2592,0,银耳的营养价值,银耳有哪些吃法？
1943,1943,0,关于生理期减肥 有四点要清楚,减肥蔬菜什么蔬菜减肥
669,669,1,松露是什么,什么是松露
1776,1776,0,肠道顺自然瘦！每天1杯果汁养成易瘦体质,清肠道的食物有哪些？
1283,1283,0,蜂蜜生姜水防老年斑,吃什么预防老年斑？
84,84,1,三种食物吃出水嫩肌肤,我想知道水嫩肌肤的秘诀
159,159,1,天然刮油减脂食物有哪些呢？,吃什么可以刮油减脂
955,955,0,想减肥？米饭应该这么吃,排骨米饭广告语
2113,2113,0,4款补血补气美味 让你美过大明星,补气的食物有哪些
428,428,1,睡前几个动作甩掉大肚腩,推荐睡前甩掉大肚腩的动作
2972,2972,0,"好肤色也可以""喝""出来 8款适合女性的滋补汤",排骨煲什么最滋补
3099,3099,0,怎么吃都不长肉？太瘦的人要当心了,女性应当心多囊卵巢综合症
3209,3209,0,女性需要远离的8大体臭食物,一辈子需要远离的零食，就是这几种
2550,2550,0,秋季吃枣 美白抗衰老,美白防晒面膜
2628,2628,0,牛肝菌的营养价值,什么牛肝菌最好
2250,2250,0,十种食品 打造零毛孔美人,腋下毛孔堵塞的治疗方法
626,626,1,竹荪的功效与作用,竹荪的功效有哪些
574,574,1,几种具有保健功效的菌类食物,具有保健功效的菌类食物有哪些
646,646,1,松茸的功效及做法,松茸要怎么做
97,97,1,枸杞桂圆汤 加上3种料美容更营养,推荐美容更营养的食物
2512,2512,0,4种饮食法 专门瘦小腹,高血压要注意哪些饮食
2273,2273,0,减肥食物 16种减肥食物排行榜,减肥方法
979,979,0,金针菇的营养价值,金针菇炒什么好吃
2908,2908,0,16款排毒减肥餐 边吃边甩肉,哪些蔬菜可以减肥这五大蔬菜减肥甩肉好
1968,1968,0,双色牛肝菌简介,鲜牛肝菌的做法
2238,2238,0,每天吃点菌类食品，营养加分,五种食物最好每天吃点
1826,1826,0,五款美白汤饮喝出嫩白肌肤,牛筋白汤做法
1700,1700,0,加餐4个小技巧 减肥成功吃得好,正确“加餐”让你瘦
2269,2269,0,减肥食物 16种减肥食物排行榜,减肥减肥减肥减肥
2410,2410,0,松茸的功效及做法,松茸哪个好？
2624,2624,0,每天一顿杂粮可以抗衰老,五谷杂粮有哪些
2797,2797,0,抗衰老的7个方法 巧用绿茶美容,绿茶的种类有哪些
2394,2394,0,适合减肥的九款低热量食物,减肥蔬菜什么蔬菜减肥
3103,3103,0,怎么吃都不长肉？太瘦的人要当心了,过度饮水当心“水中毒”
3019,3019,0,玉米的养颜功效,瘦身养颜的煲汤有哪些
3221,3221,1,减肥要吃4种食物 让你变成“小腰精”,减肥食品
2941,2941,0,想要更加苗条 没事喝点儿茶,想要更加苗条没事喝点儿茶
3028,3028,0,草莓沙拉可减肥 酸奶代替沙拉酱,自制沙拉酱
929,929,0,红血丝怎么修复 红血丝应该怎么办,眼白里的红血丝大揭秘
246,246,1,喝啤酒会长胖么？,长胖是不是喝啤酒导致的？
113,113,1,六大健康食物给爱美的你,吃哪些食物健康
2726,2726,0,4个小窍门帮你快速瘦掉大粗腿,食物帮你除臭
1832,1832,0,春季也需要防晒，分享几个小技巧,妙吃水果的防晒护理
1316,1316,0,竹荪的功效与作用,竹荪的做法
1928,1928,0,减肥应该吃什么 了解热量科学减肥,减肥餐
679,679,1,平菇的营养成分及药用价值,平菇的营养成分和药用价值有哪些
2593,2593,0,银耳的营养价值,银耳红枣汤
431,431,1,减肥但想吃曲奇 全麦曲奇拯救你,哪些零食对减肥有帮助
1746,1746,0,7款不可错过的饮食小偏方 让你轻松瘦下来,增强免疫力偏方
1221,1221,0,自制美容养生粥 方便美味又健康,美容养生粥
647,647,1,松茸的功效及做法,松茸的制作方法有哪些
3175,3175,0,备孕推荐食谱,备孕期间不能吃什么
965,965,0,美味芦笋15日完美瘦身,紫芦笋的做法有哪些
1040,1040,0,春季护肤怎么做 补充维C能保湿,哪些水果含有维C多？
2155,2155,0,6款番茄减肥食谱 让你吃出好身材,这样饮食，让你一生不得癌！
430,430,1,学会5招让你久坐不发胖,推荐久坐不发胖的招数
2638,2638,0,这种减肥泡菜 三分钟搞定,6款食谱搞定各种肾虚
2718,2718,0,经常看电脑眼睛都要瞎掉了 喝这个管用吗,控制食欲吃什么最管用？
2008,2008,0,晚上这样吃，只会越来越瘦,吃什么可以瘦臀部
1118,1118,0,这些食物只吃不胖！减肥族请保存,减肥食谱
520,520,1,消灭肚腩的四个饮食方案,什么饮食方案可以消灭肚腩
2824,2824,0,吃东西的时间并不影响你减肥,睡前吃东西易脱发
654,654,1,鸡腿菇的做法及营养价值,鸡腿菇的营养价值怎么样
710,710,1,牛肝菌的功效与作用及做法,牛肝菌有什么作用
1683,1683,0,适量蔬果汁 排毒又美容,天天五蔬果防癌
1949,1949,0,毛木耳-纺织和矿山工人很好的保健食品,孕期保健手册
1666,1666,1,4款食谱助你保养皮肤消雀斑,消除雀斑的几道食物
3023,3023,0,玉米的养颜功效,排毒养颜的水果有哪些
2632,2632,0,牛肝菌的营养价值,牛肝菌是什么
3223,3223,0,减肥要吃4种食物 让你变成“小腰精”,减肥减肥减肥减肥
409,409,1,晚餐饮食减肥的5个技巧,晚餐饮食减肥有哪些技巧
995,995,0,清肠素食 肠道变得更年轻,清肠道的食物有哪些？
1882,1882,0,低脂食品不能减脂，还会使人发胖,白领的减脂大作战
3214,3214,0,减肥沙拉那种酱好 这三种酱可代替沙拉酱,烧烤酱配方
1618,1618,0,六大健康食物给爱美的你,哪些食物是纤维食物
2209,2209,0,5款冠军茶 喝茶变苗条,控制食欲锁定苗条完美身型
59,59,1,祛斑吃什么？ 3种果蔬帮你忙,哪些果蔬可以祛斑
3061,3061,0,美容吃猪皮并不有效,猪皮的做法大全
1355,1355,0,饭前喝点水就能瘦？,吃什么可以瘦臀部
514,514,1,小事让皮肤变好,让皮肤变好的办法是什么
77,77,1,春季也需要防晒，分享几个小技巧,分享几个春季防晒的技巧
738,738,1,猴头菇的功效与作用,猴头菇有什么功效
2554,2554,0,秋季吃枣 美白抗衰老,美白问答篇
2715,2715,0,经常看电脑眼睛都要瞎掉了 喝这个管用吗,上火吃这些食物最管用
1387,1387,0,明星好身材吃素吃出来,女性长期吃素衰老快
2631,2631,0,牛肝菌的营养价值,牛肝菌的栽培技术
2680,2680,0,春季美颜的4种食材,十种食物美颜抗衰老
3159,3159,0,为啥你喝凉水都长肉？,炒蔬菜时切勿放凉水
280,280,1,香蕉热量低 但减肥不可取,减肥不可取的水果有哪些
1672,1672,0,4款食谱助你保养皮肤消雀斑,脸上长雀斑是什么因素引起的？
978,978,0,金针菇的营养价值,金针菇的吃法
665,665,1,鸡枞菌的营养价值及做法,鸡枞菌的制作方法有哪些
3051,3051,0,多吃菌菇 能够美容养出好皮肤,菌菇的种类
769,769,1,草菇的功效与作用及食用宜忌,草菇的功效是什么
759,759,1,红菇的营养价值及功效,红菇有怎样的营养价值和功效
1919,1919,0,肥胖的真正敌人是谁？,拒绝肥胖拒绝5点
2343,2343,0,祛斑吃什么？ 3种果蔬帮你忙,柠檬水可以祛斑美容
1218,1218,0,自制美容养生粥 方便美味又健康,哪个品牌养生粥好
3213,3213,0,减肥沙拉那种酱好 这三种酱可代替沙拉酱,意面买什么酱
2454,2454,0,秋季护肤 美白防晒不能停,四类中药防晒又养生
1993,1993,0,3月怎能不减肥 3种可以减肥的食物,减肥餐
1464,1464,0,春季瘦身 草莓可以帮你减肥,7食物帮你调节内分泌
3155,3155,1,木耳的功效与作用及做法,木耳的药用价值有哪些呢
200,200,1,皮肤保养的饮食宜忌 让你的皮肤吹弹可破,怎么饮食能保养皮肤
664,664,1,鸡枞菌的营养价值及做法,鸡枞菌要怎么做
3268,3268,0,这些食物是长肉的助手，减肥的敌人,补气不长肉的食物
2699,2699,1,地耳的功效与饮食宜忌,地耳的营养价值
1274,1274,0,平菇的营养成分及药用价值,蚝油焖平菇
935,935,0,吃甜食7个技巧 让你不发胖,特色色拉不发胖
2714,2714,0,经常看电脑眼睛都要瞎掉了 喝这个管用吗,营养神经管用食物有哪些
2932,2932,0,节食减肥会引起这6个病症,保苗条有效节食6秘诀
2259,2259,0,5大减肥技巧 让你越吃越瘦,越吃越瘦的食物
1795,1795,0,吃保健品排毒不如吃红薯,什么是排毒
2481,2481,0,春季防晒的几个小窍门,汤圆煮法有什么窍门？
2794,2794,0,抗衰老的7个方法 巧用绿茶美容,绿茶有哪些品种
2642,2642,0,这种减肥泡菜 三分钟搞定,脚气困扰—柳橙轻松搞定
2529,2529,0,推荐三款玉米养颜食谱 让皮肤白亮起来,皮肤白亮润燥好皮肤是吃出来的
21,21,1,秋季护肤 美白防晒不能停,秋季怎么护肤更好
