,Unnamed: 0,match,q1,q2
3261,3261,0,盘点5大瘦脸食物 轻松吃出V形脸,最伤胃食物大盘点
1586,1586,0,银耳饮食宜忌百科,3种咳嗽的饮食宜忌
2773,2773,0,白醋洗脸 4种方法让你变白变美,神奇揭秘喝这些水让女人变美
2887,2887,0,润肤养发四季百搭美食 这种食物真的有,养胃茶有哪些
1075,1075,0,6种方法 选出优质胶原蛋白食物,吃胶原蛋白有什么好处呢
681,681,1,香菇的功效与作用,香菇的作用有哪些
1421,1421,0,枸杞桂圆汤 加上3种料美容更营养,桂圆的功效
1573,1573,0,减肥人士吃鸡蛋不应该排斥蛋黄,蛋黄片的做法有哪些
273,273,1,吃水果减肥 两大误区一定认清,如何正确的吃水果减肥
1285,1285,0,蜂蜜生姜水防老年斑,多吃菇可以少长老年斑
1252,1252,0,女性脱发不可怕 这6个方法能帮到你,天天吃豆腐会发生啥可怕的事
258,258,1,十二个最快减肥秘籍法,推荐最快减肥秘籍的方法
2531,2531,0,吃蔬菜沙拉可以减肥吗 原来是这么回事儿,做蔬菜沙拉适合用什么酱
2812,2812,0,春季护肤必须要知道这4点,白色花卉成分护肤给力
2743,2743,0,头发总出油怎么办？教你护理小妙招,鱼肉烹饪小妙招
2004,2004,0,瘦腰课程表 吃着减赘肉,针对赘肉量身选择瘦身果蔬
522,522,1,便宜材料 强力美白,便宜材料强力美白的方法
2779,2779,0,白醋洗脸 4种方法让你变白变美,常吃7种蔬菜自然肌肤变美白
2825,2825,0,吃东西的时间并不影响你减肥,几点以后不能吃东西
3009,3009,0,鸡枞菌的营养价值及做法,酸酸乳营养价值有哪些
2819,2819,0,春季护肤必须要知道这4点,护肤饮食三多两少
1908,1908,0,减肥但想吃曲奇 全麦曲奇拯救你,全麦食品有哪些
946,946,0,美容祛斑 4种食物帮你轻松解决,消化不良这些茶能帮你
1703,1703,0,电脑族美容 轻松祛斑小妙招,祛斑的食物
301,301,1,8种青春永驻妙招 让你永远18岁,怎么永远18岁有什么方法
2007,2007,0,瘦腰课程表 吃着减赘肉,六大蔬果击退赘肉
163,163,1,消除小肚腩的10种食物,真正消除肚腩的食物有哪些
2003,2003,0,瘦腰课程表 吃着减赘肉,减腰腹部赘肉的运动方法
1399,1399,0,8条平民减肥经验,减肥日程
791,791,0,一不留神就发胖：走路吃东西易发胖,孕期进补需留神
62,62,1,秋季吃枣 美白抗衰老,枣有什么营养
1734,1734,0,脸蛋红血丝是怎么形成的 能去除吗？,喝这些茶竟然能去湿气
490,490,1,减肥应该吃什么 了解热量科学减肥,推荐一些热量科学减肥的食物
1602,1602,0,教你两种药粥食疗方消灭轻度脂肪肝,三药粥摆脱少年白头
2679,2679,0,春季美颜的4种食材,美颜瘦身粥
1897,1897,0,女性每日一把葡萄干,葡萄干什么好处
1851,1851,0,山楂减肥汤 瘦成女神很简单,山楂的功效
3007,3007,0,鸡枞菌的营养价值及做法,哺乳期哪些东西没营养
1679,1679,0,适量蔬果汁 排毒又美容,消化不良吃什么蔬果好？
386,386,1,想要排毒瘦身 你绝对不能错过它,想要排毒瘦身有哪些食品
1270,1270,0,平菇的营养成分及药用价值,平菇需要焯水吗
515,515,1,小事让皮肤变好,怎样做可以让皮肤变好
3001,3001,0,鸡枞菌的营养价值及做法,哪种蛋类最营养？
706,706,1,木耳的功效与作用及做法,木耳有怎样的作用和功效
1441,1441,0,8款美容面膜DIY,滋润面膜：马铃薯润滑面膜
1647,1647,0,平菇的做法及功效,平菇是发物么
1729,1729,0,银耳的功效与作用,银耳红枣汤
2013,2013,0,晚上这样吃，只会越来越瘦,瘦腿计划
1211,1211,0,5种食物容易伤害皮肤 远离！,让宝宝远离慢性胃炎
2243,2243,0,十种食品 打造零毛孔美人,巧用四种食物解决毛孔问题
1933,1933,0,减肥应该吃什么 了解热量科学减肥,减肥方法
2921,2921,0,香菇健康饮食百科,香菇面筋的做法有哪些
2348,2348,0,嘴巴周围长痘怎么办 这样做巧妙去痘,吃什么食物可以有效的排毒，去痘？
45,45,1,怎样消除妊娠纹,妊辰纹可以消除吗
1824,1824,0,5时段喝水才能真正瘦下来,喝水会胖吗
1671,1671,0,4款食谱助你保养皮肤消雀斑,把雀斑消灭在餐饮中
1202,1202,0,喝汤可以增加饱腹感,魔芋粉减肥？饱腹感极强！
282,282,1,西红柿可祛斑 你知道到吗,祛斑吃西红柿有用吗
1986,1986,0,春天减肥 多吃这些豆类让你瘦得更健康,聪明饮食瘦得快日常减肥小技巧
999,999,0,原来茶叶水能这样用来美容！,什么水果美容减肥
1836,1836,0,春季也需要防晒，分享几个小技巧,年龄不同防晒不一样
2183,2183,0,豆腐搭配牛奶 轻松瘦身,果蔬汁减肥瘦身饮有哪些
2649,2649,0,想要祛斑？多吃绿豆百合,祛斑有哪几种有效的方法
550,550,1,黑木耳的功效与作用及食用方法,黑木耳可以怎么样食用
2299,2299,0,乳酸菌的作用与功效,乳酸菌是什么
1344,1344,0,鸡油菌的做法及功效,鸡油菌能降血糖吗
228,228,1,十种食品 打造零毛孔美人,哪些食品可以收缩毛孔
1924,1924,0,肥胖的真正敌人是谁？,这些因素导致肥胖
1818,1818,0,5时段喝水才能真正瘦下来,喝水能减肥喝水的3大好处
1955,1955,0,芝麻花生帮女人身材升Cup！,食用芝麻的益处
3002,3002,0,鸡枞菌的营养价值及做法,女性营养食谱有哪些
1773,1773,0,肠道顺自然瘦！每天1杯果汁养成易瘦体质,吃什么可以促进肠道蠕动呢
3157,3157,0,木耳的功效与作用及做法,木耳是什么味
2989,2989,0,草菇的功效与作用及食用宜忌,食物的宜忌原则
33,33,1,推荐四款蔬菜汁美容去斑点,请告诉我能美容祛斑的蔬菜汁怎么做
1080,1080,0,6种方法 选出优质胶原蛋白食物,猪肉胶可以做的菜式
712,712,1,牛肝菌的功效与作用及做法,牛肝菌有什么功效
1078,1078,0,6种方法 选出优质胶原蛋白食物,花胶汤可以冲啊胶?
603,603,1,点柄黏盖牛肝菌的简介,点柄黏盖牛肝是什么
1266,1266,0,6种食物 让你“吃”出好身材,饮食运动健康秀身材
3170,3170,0,平菇的功效与作用及购买指南,平菇是什么？
1937,1937,0,关于生理期减肥 有四点要清楚,减肥餐
3032,3032,0,草莓沙拉可减肥 酸奶代替沙拉酱,沙拉酱蔬菜做法
2,2,1,山楂减肥汤 瘦成女神很简单,怎样瘦成女神呢？
2185,2185,0,皮肤会变黑全是因为它们,吃什么才能让白发变黑发呢
1134,1134,0,要是减肥 喝水都能瘦,喝水的好处
79,79,1,润肤养发四季百搭美食 这种食物真的有,推荐润肤养发的美食
1150,1150,0,上班族减掉赘肉的小妙招,鱼肉烹饪小妙招
2112,2112,0,4款补血补气美味 让你美过大明星,补血补气食物有哪些
1478,1478,0,加速衰老的6种行为,衰老的原因有哪些延缓衰老的方法
2300,2300,0,乳酸菌的作用与功效,乳酸菌的药用价值
477,477,1,改善干燥 春季多吃胡萝卜,胡萝卜有哪些功效
1794,1794,0,吃保健品排毒不如吃红薯,吃什么排毒
1300,1300,0,六种可以让你急速减肥的蔬菜,减肥方法
1974,1974,0,手把手教你做减肥果汁,手把手教你鱼糕的家常做法
1542,1542,0,蔡依林三个苗条魔咒,苗条身材是因为吃的杂？
507,507,1,4种饮食法 专门瘦小腹,有哪些饮食法 专门瘦小腹
1711,1711,0,怎样防止乳防下垂,防止臀部下垂最好就是多吃这个
2133,2133,0,干巴菌的做法,干巴菌的功效与作用
557,557,1,蘑菇的功效与作用及营养价值,蘑菇有什么功效
432,432,1,减肥但想吃曲奇 全麦曲奇拯救你,全麦曲奇有利于减肥吗
2218,2218,0,五款茶饮 去掉小肚腩,五款茶饮去掉小肚腩
1293,1293,0,六种可以让你急速减肥的蔬菜,减肥日程
2040,2040,0,春季皮肤常见问题 3个对策各个击破,早孕反应的饮食对策
1842,1842,0,5个注意事项 将染发伤害降到最低,染发避开这4条否则会毁容
686,686,1,草菇的营养价值及药性功效,草菇有哪些营养价值
2603,2603,0,牛肝菌的功效与作用及做法,牛肝菌的栽培技术
811,811,0,改善皮肤暗黄不做“黄脸婆”,调理脾胃不做黄脸婆
1137,1137,0,要是减肥 喝水都能瘦,每天多喝水的好处有哪些
3163,3163,0,为啥你喝凉水都长肉？,凉水煮饭真的好？
3090,3090,0,吃蔬菜有啥好处？巧吃蔬菜不变老,有啥好吃的！？
1491,1491,0,燕麦八宝饭 最简单的减肥饭,八宝饭广告词
2790,2790,0,盘点减肥要远离的四大食物,减肥方法
1936,1936,0,关于生理期减肥 有四点要清楚,减肥食品
1626,1626,0,8种青春永驻妙招 让你永远18岁,生活小妙招
3140,3140,1,西红柿可祛斑 你知道到吗,祛斑吃什么食物调理
122,122,1,美容吃猪皮并不有效,吃什么可以美容
1607,1607,0,鸡蛋去黑头 因人而异有点儿用,小寒养生因人而异
1612,1612,0,鸡蛋去黑头 因人而异有点儿用,日常饮食日进几餐因人而异
2747,2747,0,土豆四大好处 瘦身美容又养生,减肥瘦身水果有哪些
17,17,1,4款补血补气美味 让你美过大明星,有哪些即美味又能补气血的食品？
3127,3127,0,蘑菇的功效与作用及营养价值,什么样的蘑菇有毒
2309,2309,0,食疗还是保健品 女性应该怎样补充胶原蛋白,胃病食疗
60,60,1,4款食谱助你保养皮肤消雀斑,请推荐可以淡斑的食谱
2591,2591,1,银耳的营养价值,银耳有哪些好处？
3078,3078,0,喝3种茶去除口臭，与人交流不再尴尬,2种食物预防口臭
1116,1116,0,这些食物只吃不胖！减肥族请保存,减肥餐
2231,2231,0,消灭肚腩的四个饮食方案,11种食物甩掉你的小肚腩
495,495,1,上这5种肉最适合减肥的人吃,哪些肉适合减肥的人吃
2447,2447,0,教你只花4分钟 炮制减肥早餐,紫苏叶炮制方法有哪些
3076,3076,1,怎么去鱼尾纹 用这物就能解决,4个饮食窍门减退鱼尾纹
164,164,1,消除小肚腩的10种食物,吃什么食物可以消除小肚腩
3145,3145,1,西红柿可祛斑 你知道到吗,吃什么水果祛斑？
821,821,0,吃出来的俏丽容颜 4道药膳来美容,胃溃疡药膳有哪些？
575,575,1,几种具有保健功效的菌类食物,推荐几种具有保健功效的菌类食物
2462,2462,0,天然刮油减脂食物有哪些呢？,天然刮油减脂食物
2947,2947,0,香菇：排毒抗癌，益气治风,什么食品排毒
1203,1203,0,喝汤可以增加饱腹感,十一大饱腹感强的食物
1138,1138,0,要是减肥 喝水都能瘦,喝水的时间介绍
2215,2215,0,5款冠军茶 喝茶变苗条,八款蔬菜越吃越苗条
1121,1121,0,这些食物只吃不胖！减肥族请保存,减肥方法
125,125,1,九个方法帮你快速去掉黑眼圈,哪些方法可以快速去掉黑眼圈
72,72,1,帮助你快速减肥的五个方法,有哪些方法可以快速减肥
2162,2162,0,秋季如何快速全身美白,美白果汁
1667,1667,0,4款食谱助你保养皮肤消雀斑,不能吃有雀斑的水果
988,988,0,清肠素食 肠道变得更年轻,五种方法疏通肠道
1867,1867,0,春季减肥的九个方法,减肥减肥减肥减肥
3180,3180,1,备孕推荐食谱,男性备孕食谱有哪些
1369,1369,0,想要美白 这些食物要少吃,防止皮肤变黑应少吃什么
2789,2789,0,盘点减肥要远离的四大食物,减肥计划
1566,1566,0,零负担减肥食物 享瘦又健康,九种食物助你整夜享美梦
2484,2484,0,喝它可排毒 久服可轻身,黄瓜把儿可排毒养颜
1486,1486,0,燕麦八宝饭 最简单的减肥饭,八宝饭的做法大全是什么
1740,1740,0,菠萝帮你清体美容消脂,食物帮你除臭
2088,2088,0,经期减肥法 确有效果还是商家炒作,经期可以吃的零食有哪些
1714,1714,0,怎样防止乳防下垂,预防胸部下垂的方法
1988,1988,0,春天减肥 多吃这些豆类让你瘦得更健康,多吃乳制品能让你瘦得更健康
2991,2991,0,苹果牛奶减肥法 让你2天瘦7斤,一瘦再瘦的零食清单
1059,1059,0,每天坚持吃蔬果 轻松瘦身,果蔬汁减肥瘦身饮有哪些
1303,1303,0,小美牛肝菌的简介,牛肝菌那个品种最好
390,390,1,健康减肥 6种蔬菜帮你快速瘦身,推荐几种蔬菜可以健康减肥的
2034,2034,0,五种瘦身早餐 让你轻松瘦下来,这样饮食，让你一生不得癌！
1436,1436,0,减肥不吃早餐的五大危害,减肥方法
2266,2266,0,减肥食物 16种减肥食物排行榜,减肥日程
2780,2780,0,白醋洗脸 4种方法让你变白变美,女人吃了就会变美的8种食物
2817,2817,0,春季护肤必须要知道这4点,五款护肤美容食谱
1206,1206,0,5种食物容易伤害皮肤 远离！,孕妇应远离垃圾食品
2035,2035,0,五种瘦身早餐 让你轻松瘦下来,经常吃它们让你更快衰老
2011,2011,0,晚上这样吃，只会越来越瘦,五种饮食搭配想瘦就瘦
2895,2895,0,便宜材料 强力美白,美白果汁
1178,1178,0,女人每月“那几天”吃什么最健康养颜,瘦身养颜的煲汤有哪些
589,589,1,黑木耳的功效与作用,黑木耳有怎么样的功效
1190,1190,0,这样吃粗粮 不用运动也能变瘦,一日三餐这么吃能变瘦
1780,1780,0,减肥美容冬瓜饮的自制方法,冬瓜和什么相克
1619,1619,0,六大健康食物给爱美的你,哪些食物可以消食
1880,1880,0,低脂食品不能减脂，还会使人发胖,星座MM减脂该吃什么
2868,2868,0,猴头菇的功效与作用,干猴头菇的做法
1111,1111,0,喝茶能够祛斑？要怎样喝呢？,吃什么水果祛斑？
1726,1726,0,银耳的功效与作用,吃银耳有哪些禁忌
2304,2304,0,食疗还是保健品 女性应该怎样补充胶原蛋白,气管炎食疗
295,295,1,土豆四大好处 瘦身美容又养生,土豆有哪些功效，能瘦身吗
2312,2312,0,敏感肌MM春季护肤注意5件事,不得不做的饭前3件事
2247,2247,0,十种食品 打造零毛孔美人,润肤露会不会堵塞毛孔
1547,1547,0,黑木耳饮食宜忌百科,脂肪肝的饮食宜忌
3262,3262,0,盘点5大瘦脸食物 轻松吃出V形脸,抗低血压饮食盘点
2798,2798,0,抗衰老的7个方法 巧用绿茶美容,炒青绿茶有哪些
3227,3227,0,减肥要吃4种食物 让你变成“小腰精”,减肥方法
29,29,1,推荐三款玉米养颜食谱 让皮肤白亮起来,请告诉我能让皮肤亮起来的养颜食谱
512,512,1,8条平民减肥经验,平民减肥有些什么经验
2398,2398,0,吃素减肥不可取,肉过量和拒食肉均不可取
1918,1918,0,肥胖的真正敌人是谁？,孩子肥胖原因有哪些
554,554,1,黑木耳的功效与作用及食用方法,我想知道黑木耳的功效和食用方法
1262,1262,0,6种食物 让你“吃”出好身材,魔鬼身材十招
12,12,1,改善皮肤暗黄不做“黄脸婆”,如何改善皮肤暗黄？
3132,3132,1,减肥最佳食品——豆腐,减肥食品
639,639,1,头状秃马勃的功效与作用,头状秃马勃的作用有哪些
636,636,1,双色牛肝菌简介,双色牛肝菌是什么
543,543,1,5时段喝水才能真正瘦下来,怎样喝水才能真正瘦下来
3205,3205,0,女性需要远离的8大体臭食物,让宝宝远离慢性胃炎
15,15,1,秋季如何快速全身美白,怎样可以全身快速美白？
2021,2021,0,学会5招让你久坐不发胖,久坐人群的蔬菜排毒法
1185,1185,0,女人每月“那几天”吃什么最健康养颜,养颜补血茶有哪些
264,264,1,吃出小蛮腰的瘦身餐（）,小蛮腰的瘦身餐有哪些（）
1802,1802,0,上这5种肉最适合减肥的人吃,减肥蔬菜
3135,3135,1,减肥最佳食品——豆腐,减肥食谱
2277,2277,0,轻易祛斑小妙招：丝瓜调和蜂蜜,祛斑的食物
2354,2354,0,春季减肥4大问 排毒帮你减体重,什么食品排毒
292,292,1,晚上怎么吃水果帮助减肥？,推荐晚上可以减肥的水果
2569,2569,0,吃出小蛮腰的瘦身餐（）,果蔬汁减肥瘦身饮有哪些
2907,2907,0,牢记生活细节 甩掉你的小肚腩,六大吃法必平你小肚腩
1064,1064,0,5个妙招 轻松解决皮肤出油,鱼肉烹饪小妙招
950,950,0,美容祛斑 4种食物帮你轻松解决,这些食物帮你保护肝脏
2744,2744,0,头发总出油怎么办？教你护理小妙招,辅食制作妙招
1254,1254,0,女性脱发不可怕 这6个方法能帮到你,跷二郎腿时身体发生可怕变化
1869,1869,0,春季减肥的九个方法,减肥蔬菜
1719,1719,0,小事让皮肤变好,身材皮肤变好8种食物
2051,2051,0,石斛的5种吃法 美容又养生,石斛的做法介绍
2239,2239,0,每天吃点菌类食品，营养加分,过年吃点什么好呢..
1468,1468,0,春季瘦身 草莓可以帮你减肥,美食帮你减肥
2121,2121,0,肌肤不均匀 改善肌肤从这入手,细腻肌肤吃出来
403,403,1,6种常见水果让你瘦成瓜子脸,瘦成瓜子脸要吃哪些常见水果
1921,1921,0,肥胖的真正敌人是谁？,肥胖儿童应科学选择食品
1417,1417,0,9种吃了不用去美容院的食物,美容院用什么方法减肥，急急急
2727,2727,0,4个小窍门帮你快速瘦掉大粗腿,美食帮你减肥
537,537,1,主妇秘笈:减肥就要这样做饭,怎样做饭能减肥
411,411,1,几款自制养颜美容茶助你排出毒素,哪些自制美容茶可排出毒素
2686,2686,0,春季美颜的4种食材,7种美颜护肤的食物
533,533,1,番茄瘦身法,用番茄如何瘦身
694,694,1,平菇的功效与作用及购买指南,食用平菇有怎么的功效和作用
1458,1458,0,饭前吃蔬菜有助减肥,减肥蔬菜
2081,2081,0,饮食减肥大全,减肥方法
2181,2181,0,豆腐搭配牛奶 轻松瘦身,瘦身减肥食谱有哪些
2177,2177,0,四季瘦身 一年四季都适合减肥的水果,柠檬水瘦身法跨越冬春两季
947,947,0,美容祛斑 4种食物帮你轻松解决,水果帮你解决便秘烦恼
3010,3010,1,春夏多吃三种食物易排毒,哪种家常菜可以排毒？
2090,2090,0,经期减肥法 确有效果还是商家炒作,经期喝的茶哪些好
1610,1610,0,鸡蛋去黑头 因人而异有点儿用,4个养生误区养生应因人而异
2103,2103,0,科学减肥 需要三管齐下,减肥蔬菜什么蔬菜减肥
624,624,1,竹荪的功效与作用,竹荪的作用有哪些
318,318,1,春季护肤怎么做 补充维C能保湿,补充维C对皮肤有什么功效
601,601,1,小美牛肝菌的简介,小美牛肝菌能吃吗
943,943,0,美容祛斑 4种食物帮你轻松解决,日常饮品帮你预防疾病
2952,2952,0,女人爱自己 经期喝玫瑰花茶可缓解抑郁,玫瑰花茶适合什么季节喝
745,745,1,地耳的功效与饮食宜忌,地耳不可以和什么食物搭配
2049,2049,0,吃菌类食物的科学方法,这个是什么菌类
2519,2519,0,减肥效果最佳的3个时间,减肥日程
2626,2626,0,每天一顿杂粮可以抗衰老,哪些杂粮是碱性的
340,340,1,菠萝帮你清体美容消脂,吃什么水果可以美容消脂
2576,2576,0,8种食物能轻松消除小肚腩,"蔬菜""降脂药""消除小肚腩"
2193,2193,0,酸奶加点料 甩掉小肚腩,五款茶饮去掉小肚腩
598,598,1,金针菇的功效与作用,金针菇的功效和作用有哪些
959,959,0,想减肥？米饭应该这么吃,京九排骨米饭
1122,1122,0,这些食物只吃不胖！减肥族请保存,减肥蔬菜什么蔬菜减肥
2951,2951,0,女人爱自己 经期喝玫瑰花茶可缓解抑郁,玫瑰花茶的泡法
1189,1189,0,这样吃粗粮 不用运动也能变瘦,这样吃粗粮不用运动也能变瘦
3111,3111,0,两周都可以不重样 11种低卡路里早餐推荐,儿童早餐需要哪些营养
136,136,1,治疗女性月经量少的5大健康食谱,月经量少怎么调理，吃什么好
462,462,1,原来茶叶水能这样用来美容！,茶叶水可以用来美容吗
961,961,0,核桃松仁粟米羹美容又健胸,核桃松仁粟米羹的做法是什么？
28,28,1,推荐三款玉米养颜食谱 让皮肤白亮起来,有什么玉米养颜食谱吗？
1675,1675,0,4款食谱助你保养皮肤消雀斑,消除雀斑五大天然食物
397,397,1,不长肉的肉食瘦身餐,推荐不长肉的瘦身餐
2707,2707,0,上班族运动减肥 别犯这4种错误,减肥蔬菜
992,992,0,清肠素食 肠道变得更年轻,吃什么可以促进肠道蠕动呢
3172,3172,0,平菇的功效与作用及购买指南,平菇鸡蛋汤
767,767,1,香菇健康饮食百科,香菇能制作健康的饮食食谱吗
1398,1398,0,减肥的人注意：4种吃法扰乱新陈代谢,早餐健康吃法有哪些
464,464,1,效果相差甚远的果蔬DIY敷面,怎么用果蔬DIY敷面
2639,2639,0,这种减肥泡菜 三分钟搞定,8招搞定消化不良
1676,1676,0,适量蔬果汁 排毒又美容,哪些蔬果绝对不能带皮吃
872,872,0,小小食盐功效多 美白祛痘好帮手,酶，美容的好帮手
323,323,1,女性脱发不可怕 这6个方法能帮到你,推荐脱发解决方法
1052,1052,0,5个错误坐姿最易导致肥胖,捍卫健康坐姿开始预防
66,66,1,为啥你喝凉水都长肉？,为什么我吃什么都会胖
1701,1701,0,电脑族美容 轻松祛斑小妙招,祛斑吃什么食物调理
2129,2129,0,肌肤不均匀 改善肌肤从这入手,敏感肌肤自制面膜
1187,1187,0,这样吃粗粮 不用运动也能变瘦,聪明吃早餐聪明变瘦
1450,1450,0,猴头菇的营养价值,猴头菇的家常做法
2778,2778,0,白醋洗脸 4种方法让你变白变美,想变美？合理膳食让你魅力四射
3115,3115,0,口蘑的功效与作用,口蘑的做法大全
356,356,1,少吃多餐可以减肥 如何吃才最减肥,怎么吃最减肥
2064,2064,0,一日吃仨枣保健又美容,养生美容茶有哪些
2616,2616,0,8个饮食原则 让你怎么吃都不胖,高血压要注意哪些饮食
953,953,0,想减肥？米饭应该这么吃,米饭的起源
3290,3290,0,果蔬让女性更有魅力,最脏果蔬排行榜
400,400,1,减肥期间喝点儿茶 健康方便又排毒,健康减肥既方便又排毒的菜有哪些
458,458,1,瘦腰课程表 吃着减赘肉,瘦腰有哪些技巧
165,165,1,消除小肚腩的10种食物,推荐消减小肚腩的食物
3014,3014,1,春夏多吃三种食物易排毒,吃什么排毒
3000,3000,0,鸡枞菌的营养价值及做法,蛋类含有哪些营养成分
3117,3117,0,口蘑的功效与作用,口蘑的几种做法
1766,1766,0,猪尾凤爪香菇汤美容丰胸效果佳,猪尾巴菜起什么名
1970,1970,0,手把手教你做减肥果汁,FDA手把手教你4步安全处理食物
43,43,1,燃烧脂肪的三大食物,哪些食物可以燃烧脂肪
333,333,1,五种瘦身早餐 让你轻松瘦下来,推荐瘦身早餐
2459,2459,0,秋季护肤 美白防晒不能停,年龄不同防晒不一样
2732,2732,0,鸡腿菇的做法及营养价值,鸡腿菇的药用价值
2975,2975,0,"好肤色也可以""喝""出来 8款适合女性的滋补汤",滋补肝脏的食物有哪些
3018,3018,0,玉米的养颜功效,养颜美容水果有哪些呢
1366,1366,0,想要美白 这些食物要少吃,孕期应少吃甜食
1590,1590,0,金针菇的功效与作用,软炸金针菇
3055,3055,0,羊肚菌的功效与作用,羊肚菌是什么
2318,2318,0,敏感肌MM春季护肤注意5件事,吃饭时最忌讳的4件事
31,31,1,盘点减肥要远离的四大食物,减肥不能吃什么
596,596,1,金针菇的功效与作用,金针菇有什么作用
304,304,1,美容祛斑 4种食物帮你轻松解决,轻松解决祛斑的食物有哪些
1639,1639,0,想要排毒瘦身 你绝对不能错过它,减肥瘦身水果有哪些
2913,2913,0,减肥吃鱼腥草，效果好不好？,鱼腥草的功效
231,231,1,当心减肥减出脂肪肝,怎么有效减肥
1029,1029,0,推荐四款蔬菜汁美容去斑点,柠檬浓缩汁
2339,2339,0,祛斑吃什么？ 3种果蔬帮你忙,祛斑吃什么食物调理
2220,2220,0,五款茶饮 去掉小肚腩,最易长小肚腩饮食
90,90,1,使用护发素要看发质 用错易长头皮屑,有头皮屑可以用护发素吗
948,948,0,美容祛斑 4种食物帮你轻松解决,食物帮你除臭
1854,1854,0,香蕉热量低 但减肥不可取,为了宝宝的健康5种儿童早餐不可取
2440,2440,0,平菇的营养价值及功效,平菇和什么相克
671,671,1,平菇的做法及功效,平菇有怎么样的功效
674,674,1,平菇的做法及功效,平菇的制作方法有哪些
919,919,0,香菇的营养价值及做法,香菇面筋的做法有哪些
1313,1313,0,竹荪的功效与作用,竹荪哪些部位能吃
1545,1545,0,蔡依林三个苗条魔咒,5个小窍门苗条吃出来
2180,2180,0,豆腐搭配牛奶 轻松瘦身,鸡蛋瘦身减肥
40,40,1,盘点5大瘦脸食物 轻松吃出V形脸,有没有哪种食物对瘦脸有帮助
1804,1804,0,上这5种肉最适合减肥的人吃,减肥方法
1196,1196,0,喝汤可以增加饱腹感,12种食物具有超强饱腹感！
2663,2663,0,巧克力是美容神器 但是不宜多吃,6种东西是护肤神器
1216,1216,0,自制美容养生粥 方便美味又健康,养生粥有哪些？
47,47,1,自制美容养生粥 方便美味又健康,怎么做美容养生粥
2227,2227,0,消灭肚腩的四个饮食方案,吃掉烦人的小肚腩
1281,1281,0,蜂蜜生姜水防老年斑,吃什么可以预防老年斑形成？
3011,3011,1,春夏多吃三种食物易排毒,排毒的食物有哪些
1414,1414,0,黑木耳的功效与作用及食用方法,黑木耳的特点
1443,1443,0,8款美容面膜DIY,美白面膜：苹果面膜
389,389,1,健康减肥 6种蔬菜帮你快速瘦身,那几种蔬菜可以快速健康减肥
3246,3246,0,草菇的营养价值及药性功效,草菇是什么样子的？
878,878,0,小小食盐功效多 美白祛痘好帮手,这些食物都是养肝好帮手
362,362,1,春季减肥4大问 排毒帮你减体重,推荐春季减肥排毒减体重的方法
1426,1426,0,枸杞桂圆汤 加上3种料美容更营养,桂圆的副作用
1449,1449,0,猴头菇的营养价值,干猴头菇的做法
3144,3144,0,西红柿可祛斑 你知道到吗,柠檬水可以祛斑美容
780,780,1,银耳饮食宜忌百科,什么样的人不能吃银耳
1753,1753,0,健康减肥 6种蔬菜帮你快速瘦身,瘦身减肥食谱有哪些
1859,1859,0,食物这样吃 可以让你快速瘦身,减肥瘦身果有哪些功效
